TEAM NAMES,Series Number,Filename,Name,Description,Gender,Attributes,UUID,Hash
TEAM BEVEL,1,adewale-the-amebo,adewale the amebo,Adewale likes to be in everyone's business. ,Male,hair: bald; eyes: black; teeth: none; clothing: red; accessories: mask; expression: none; strength: powerful; weakness: curiosity,cad316c3-37f8-4b27-9f53-9d803bfcfee7,9b01aa6b83b68b00ad88c513ba6264ec698037e75d67e821acd7d7111192b29e
,2,alli-the-queeny,alli the queeny,Alli is an LGBT Stan.,Male,hair: bald; eyes: white; teeth: none; clothing: yellow; accessories: mask; expression: none; strength: powerful; weakness: none,a57ecda4-a26f-4e97-a757-e1800af39aab,1a2f5fa46988c505d73ebf3e9e83f59bc6124466915c2471792294069df2c458
,3,aminat-the-snnobish,aminat the snnobish,Aminat never really wants to talk to anyone.,Female,hair: brown bun; eyes: none; teeth: none; clothing: yellow; accessories: glasses; expression: blank; strength: none; weakness: attitude,0e37ed0d-3e84-4f32-a91f-ec9c4ba8c7de,3f9a85b65e8fbb78e6ba325b624b6dd7ee66b6144a902b195cdd520293aa713c
,4,aminu-the-carpenter,aminu the carpenter,Aminu's hands are blessed; he makes the best furniture in the whole of Kano.,Male,hair: bald; eyes: blue; teeth: none; clothing: yellow; accessories: mask; expression: none; strength: powerful; weakness: none,4f30b751-96e7-40fe-97fd-e3d44973ff2f,4d4edf2b2e5baebbbec37ac5c7922e4637ac2395d31b9ef450c95dbafa5f2be5
,5,chibuike-the-kudibag,chibuike the kudibag,Chibuike is too rich. Everyone wonders how he got it.,Male,hair: bald; eyes: black; teeth: none; clothing: blue; accessories: mask; expression: none; strength: hustler; weakness: none,5ce854f2-7ac1-46fd-b3fe-57583935d1e5,a2d32375db3111227909ecd5264709c5a79bd3a63dea2fb653012dcf2ec33d07
,6,chidinma-the-model,chidinma the model,From Paris' runways; to London's streets; she's always in demand.,Female,hair: brown hair; eyes: none; teeth: none; clothing: multicolored; accessories: glasses; expression: none; strength: hardworking; weakness: none,c98db72e-49ac-4ca6-89d5-e00f5fbbcc45,343e4ff0fb838abb603805055cdefc43217395c1d80d9b975dc9162abbb359da
,7,chioma-pretty- girl,chioma pretty girl,Chioma's face card is a 100.,Female,hair: dreads; eyes: none; teeth: none; clothing: multicolored; accessories: glasses; expression: none; strength: none; weakness: none,182ea888-a85b-42ca-ad73-ed4f8f9aa5c7,4c3547647dd438c9fbbc51e735cf885d2095fec2ea94d8ed9359eeb77a89164e
,8,damilare-the-handsome,damilare the handsome,He's a fine boy; proper eye candy. ,Male,hair: bald; eyes: white; teeth: none; clothing: yellow; accessories: mask; expression: none; strength: none; weakness: none,27eca2dc-d7df-474a-8f8f-1858152c711e,7ea3d5447ac0d4f37455a73c3e55bed3a3f1e5ed401352cdfa0b2243333a4dfa
,9,ebiowie-the-planter,ebiowie the planter,Ebiowei has a reputation for nurturing plants.,Male,hair: bald; eyes: none; teeth: none; clothing: multicolored; accessories: none; expression: none; strength: powerful; weakness: none,f1df8270-4d60-4bd4-8959-ba7c384db5c4,dab9cd83151b643bd6a2e189644a13fcbb6bfa18702ebf13235f7c8b0faef832
,10,emeka-the-businessman,emeka the businessman,Emeka only cares about containers. No time to waste.,Male,hair: bald; eyes: white; teeth: none; clothing: orange; accessories: mask; expression: none; strength: hard worker; weakness: none,9b3d75da-4887-4089-aee4-50de3954fdc9,f93f9502c49331336d819a3aad11d324c7407f48fc2e2460ea6db4d3b39a83e1
,11,gbeminyi-the-monk,gbeminyi the monk,He lives in a monastery off the coast. No one has heard him speak in years.,Male,hair: bald; eyes: blue; teeth: none; clothing: yellow; accessories: mask; expression: none; strength: none; weakness: none,c8b1fd1d-8551-4bb4-8dc4-923a9aeb39fb,0fa35b4afdce04d0270e1c022510013bd91416e6dee2c34a445eefee79419cc8
,12,henry-the-sportsman,henry the sportsman,He's played every sport known to man. Even cricket.,Male,hair: bald; eyes: yellow; teeth: none; clothing: multicolored; accessories: mask; expression: none; strength: agility; weakness: none,e1225451-bfdf-4a1f-8d37-9cce3a0bd67b,0fe72c65f6c5f5b83d8c2d81ab3bd40c93701eb7fb9e221beb5f470a791ba586
,13,mayowa-the-smallie,mayowa the smallie,Mayowa is so small but everyone loves him still.,Male,hair: bald; eyes: blue; teeth: none; clothing: multicolored; accessories: mask; expression: none; strength: none; weakness: none,dfbb4163-df24-4d54-b74c-6218a68df8bd,e9aaa838132b88c9258b57bf493f05a789bbdf6172420e72e831ae690a5cb1fc
,14,muyiwa-the-stylish,muyiwa the stylish,Muyiwa has a motto which is never to be caught unfresh.,Male,hair: bald; eyes: ash; teeth: none; clothing: multicolored; accessories: mask; expression: none; strength: creativity; weakness: none,dcf9d5a0-57b7-4126-a05e-6c8f1045d3f7,7616a32c544a2c62d3b302f2e22e33fb60dd7e19d5779dd450ec49933e30cfc7
,15,nina-paper-chaser,nina paper chaser,Nina loves money. It's all she dreams of. ,Female,hair: brown double bun; eyes: none; teeth: none; clothing: animal print; accessories: glasses; expression: none; strength: hustler; weakness: none,59524227-dc52-407c-8cca-e9e8c5fb3018,f0ecfeea6c125ab22db5332012d76014f3af390d2b55e310c76f77f1ac3d166f
,16,oluwaseun-spicy,oluwaseun spicy,He loves spicy foods. He cooks pepper and sprinkles rice on top.,Male,hair: bald; eyes: black; teeth: none; clothing: yellow and purple agbada; accessories: mask; expression: none strength: none; weakness: none,808f7007-6552-4efa-bd13-4b7c337b102b,128f77ba84b48f562ae2c0d750cfc56c0485a18d0bac2b431856c169119cf77b
,17,sesan-the-smartie,sesan the smartie,Sesan always comes first in competitions.,Male,hair: bald; eyes: blue; teeth: none; clothing: orange; accessories: mask; expression: none; strength: intelligence; weakness: none,ba3edda7-8940-4ca4-97ba-826398d5909f,012ac07cca420720008ccc5f8c00fa5b8804a21f134b08e11297bd3ca3ffebff
,18,tiwa-london,tiwa london,If she says she's in London and you see her; you're in London too.,Female,hair: braids; eyes: none; teeth: none; clothing: black top; accessories: glasses; expression: none; strength: none; weakness: untruthfulness;,78da7aeb-8352-4e25-89ac-dc48b5984089,2f97e6af1cf4db585700abf36e845f774b19948619ebaba197d49cdfaa706a06
,19,tunde-yoruba-demon,tunde yoruba demon,Tunde derives joy in breaking hearts. It's a lifestyle.,Male,hair: bald; eyes: white; teeth: none; clothing: purple and yellow agbada; accessories: mask; expression: none; strength: none; weakness: promiscuity,53b46bd7-a537-402b-b249-0b4074a8faae,73283cc8a36a766e37fbb834a89b1fe4a5f89098ee5bd6b8fcd703ae296c2391
,20,yakubu-the-zombie,yakubu the zombie,Yakubu earned his zombie title because na only dust full him head.,Male,hair: bald; eyes: black; teeth: none; clothing: green and purple agbada; accessories: mask; expression: none; strength:none; weakness:slow to understand things,4adb6781-1614-424e-8f77-fe59ffca2209,5693b3686e6533b1fe0fb9ca031134230ed31eb27b9ec080b18d5dbef2d486a4
TEAM CLUTCH,21,abdul-the-vibe,abdul the vibe,Abdul the life of the party and can never be caught un-fresh.,Male,hair: none; eyes: black; teeth: none; clothing: purple and yellow kaftan; accessories: cap; expression: happy; strength: strong; weakness: no limitation,770f817a-9d9a-4772-9a91-e66dd9d03470,14009a88b4bb8cfcfdbbfae25bf8eb74bd595310fc44c087a9eb66878a5985e1
,22,emeka-the -clown,emeka the clown,Emeka the funny man; always making silly joke.,Male,hair: none; eyes: black; teeth: none; clothing: yellow and black ankara; accessories: cap; expression: straight face; strength: funny; weakness: little physique,78810fa6-a7ef-4d83-bf57-caf49db4ee69,fd4cdcc0abec9ed066320126bc99f81e1d665a9854b195af2d2c717e37bd891e
,23,salam-the-odogwu,salam the odogwu,Salam is a big time textile marketer always sourcing for quality materials.,Male,hair: none; eyes: brown; teeth: none; clothing: wine and yellow; accessories: yayada cap; expression: happy; strength: influence; weakness: impatience,f2957ded-022c-4b07-92c6-b345d4816a67,83ede1adc8de3379bfefd847c0d09453691698e91ac9559cddf43e4915557b37
,24,charles-the-exporter,charles the exporter,Charles a business man an importer and exporter never to be caught idle.,Male,hair: none; eyes: grey; teeth: none; clothing: orange and blue; accessories: okpu ozo cap; expression: happy; strength: influential; weakness: incessant,09395e76-19ed-4852-8748-795ee7496a8e,b2d94988342d2947351661b5bd6850e87c56e43fda566813923502429959d4c1
,25,wole-the-pimp,wole the pimp,Wole knows people and his way around his city.,Male,hair: none; eyes: black; teeth: two white teeth with diastema; clothing :yellow dashiki; accessories: yori yori; expression: happy; strength: strong; weakness: promiscuous,4d94d4f7-9b69-4e43-9db1-1fe83df92857,a6a1b2a3cac30bf79470d706a621919d44706a0f744080c6f04831c214eff98d
,26,saro-the-baller,saro the baller,Saro is a baller and he is always ready to turn-up,Male,hair: orange afro; eyes: blue; teeth: two white teeth with diastema; clothing: black and yellow kente; accessories: none; expression: angry; strength: strong; weakness: insatiable,d35a7514-8996-42fb-a5f2-5a603ec679c5,6fb21b349574b677d6258d4b0798fa06a98dcc806aeb2478bf4c0e91c15edfa0
,27,ade-omo-yoruba,ade omo yoruba,Ade is an influential man and he is revered in his town.,Male,hair: none; eyes: blue; teeth: complete white teeth and a gold tooth; clothing: black and yellow kente; accessories: wine cap; expression:happy; strength: hardworking; weakness: procrastination,92984fa0-310b-4377-8a10-15965d044383,337fda92739543ed619cdb030c3a90ed1a1c6e680af26012018ab207919c4fe5
,28,shola-cool-kid,shola cool kid,Shola prefers to be alone because he hates stress.,Male,hair: none; eyes: none; teeth: none clothing: yellow t-shirt and blue dongaris; accessories: red facecap; expression: playful; strength: fun; weakness: playful,3ac5c186-bc14-4eb6-8567-cc818465a64f,281ea7a0f8315eb0bf9706fec50b924c568c3a4f5e050962a8717f59ffc014bd
,29,charlie-the-smoker,charlie the smoker,Charlie uses smoking as a coping mechanism.,Male,hair: none; eyes: black; teeth: none; clothing: black shirt with lion prints; accessories: blue cap; expression: happy; strength: nice; weakness: gullible,71a0aa22-d111-43b7-8484-43d87310bc42,f7dfd47f989cc48e61483e5332291270365914641404e55390135dd6a0a40f47
,30,femi-the-badguy,femi the badguy,Femi is one of the fliest guys in Lagos.,Male,hair: orange; eyes: black; teeth: none; clothing: white t-shirt and blue dongaris; accessories: smoking pipe; expression: unbothered; strength: fearless; weakness: intolerance,e493e3fb-a8a0-455a-854f-0f6474bbc69f,8ee937173d104885f38e93f0d3fda56e433848cdf19574a0a8e74c94b4ff4874
,31,sinzu-money,sinzu money,Sinzu loves spending money on flashy things.,Male,hair: none; eyes: blue; teeth: white complete teeth and a brown tooth; clothing: purple and yellow kaftan; accessories: green-stripped fila cap; expression: strength; strength: generous; weakness: aggressive ,942f8347-9932-4331-bd15-d0f3a048b54f,dc9746658641d324dc926a59ec4dd18d3400aea3c0c0b851eeb3f9dc818cc68e
,32,obinna-the-palmwine tapper,obinna the palmwine tapper,Obinna taps palmwine for a living.,Male,hair: none; eyes: black; teeth: none; clothing: yellow black and a touch of pink ankara; accessories: cap; expression: happy; strength: contentment; weakness: naive,0f1af056-2548-4407-bed4-abc11deae05d,8c16c69a43193cdc6148703b148df2c2363e1df57ea874afd5765ceb3d2b4ffa
,33,aminu-maikudi,aminu maikudi,Aminu is a wealthy man from a family with generational wealth. ,Male,hair: none; eyes: black; teeth: none; clothing: maroon and yellow agbada; accessories: cap; expression: unbothered; strength: confidence; weakness: selfishness,0129e7a5-e3d0-4675-92d0-1a1e55d11612,b28a8209f18f15d74807d9fbbb7e09d3cf12c5ea80b060dc7e6ef8e43572a492
,34,sabinus-the-town crier,sabinus the town crier,Sabinus delivers messages to his town people.,Male,hair: none; eyes: black; teeth: two white teeth with diastema; clothing: orange ankara with touches of blue; accessories: cap; expression: happy; strength: dexterity; weakness: impatience,01d4ce96-818e-44b1-8813-68a7d34b35ba,01a5051880c491da2e38b6d0b0b8d376401b21fbf81b517932574402ebcc656a
,35,adisa-ibadan,adisa ibadan,Adisa is an elegant man and he is adored by his people.,Male,hair: none; eyes: black; teeth: none; clothing: kente; accessories:abeti-aja cap; expression: mischievous; strength: independent; weakness: bossy,3a925f27-35f6-4dbf-9960-c6527fae5f3e,534ec0bedec8449f72be54f2ece235f44a939e7eef77c55aa2b919b2a9881927
,36,linda-the-navigator,linda the navigator,Linda knows how to make a way for herself and the people around her.,Female,hair: blonde; eyes: none; teeth: none; clothing:multicolored; accessories: glasses; expression: confused; strength: creative; weakness: insecure,71f335a6-5a4f-4410-9cea-179336f0e498,b2b34c994fda1f23d6e65d66c21db6c0182ad201aaab38617699615e705b9f08
,37,kemi-the-iron lady,kemi the iron lady,Kemi the strongest woman known to the town of Igbede people.,Female,hair: ginger; eyes: none; teeth: none; clothing: ankara; accessories:glasses and a pipe; expression: cool; strength: disciplined; weakness: perfectionist,35b11a31-5b92-49f4-8fb1-30f255d22054,7cdb950b04e8561d81cc4ab6c6ab0188ef53152f4ab8594a3391240ed05b13fb
,38,mercy-the-sassy lady,mercy the sassy lady,Mercy is a confident woman and never hesistate to show it.,Female,hair: brown; eyes: none; teeth:none; clothing: ankara; accessories: glasses; expression: sassy; strenght: creative; weakness: sensitive,7a3c70ac-927f-4a63-a3df-ab86dd27cd0f,f618d3b40545f0cdf75fa734bbb2544715ddc7c94b9d94af6763b3cec3759840
,39,sandra-money,sandra money,Sandra likes getting and spending money.,Female,hair: brown; eyes: none; teeth:none; clothing:yellow and black; accessories: glasses; expression: confused; strength: brave; weakness: overthinker,1bd95fb0-7b2e-4354-bebd-22f9cf70a1ca,adc3e64b0da60485ac1e2b9fde77314391ebf46c9e0d6ea623390ad393fc891e
,40,bimpe-the-fashionista,bimpe the fashionista,Bimpe loves wearing trendy clothes and looking gorgeous.,Female,hair: blonde; eyes: none; teeth:gap teeth; clothing: black cold shoulder shirt; accessories: glasses; expression: shocked; strength: intelligent; weakness: procrastination,92b548b7-998b-46b6-8198-80d407209483,734d9dadc036b409de22abe3f46b43879e7edfc3aeee35ff825c4939d56516d8
TEAM ENGINE,41,kim-rich-aunty,kim rich aunty,She loves spoiling her nieces and nephew.,Female,hair: pink; eyes: brown; teeth: none; clothing: ankara; accessories: none; expression: smiling; strength:brave; weakness:food,3344a73c-f15e-4afd-a1b2-3199e27eb08f,cb735bbbaaa84a670a8a5ca8bd88ca89c87b95ca04ac10fae75bbbe311826e25
,42,barbra-stark,barbra stark,She loves fine dining and spends time with family.,Female,hair: blue; eyes: brown; teeth: none; clothing: ankara; accessories: none; expression: smiling; strength:brave; weakness:food,4f31fd99-4918-42a9-a112-fa60ef36d5c6,da9dfe8f96ae828ed996845fac6753040e35a8b52470fab0c548f6f90d0569f9
,43,jean-art-dolger,jean art dolger,Loves collecting art for charity.,Female,hair: blue; eyes: brown; teeth: none; clothing: ankara; accessories: none; expression: smiling; strength: creative; weakness: food,5e1105d9-e485-462d-a5bf-1eb931976b13,165190918c91fbdf9d12b1fb545db3548e90a9f7592fadd388799ec2ef233fc7
,44,flora-burger- eater,flora burger eater,She loves eating burgers.,Female,hair: blue; eyes: brown; teeth: gap; clothing: stripes; accessories: none; expression: frowning; strength: prayerful; weakness: food,054dffd1-cdff-417b-b6c2-a679dabd087b,41629f0a0772880c528616a14e47ca7ee52fe848df1b1c548c3eef2e8306d5dd
,45,jessie-lord-rings,jessie lord rings,She loves her  (precious) jewelry.,Female,hair: blue; eyes: brown; teeth: none; clothing: satin; accessories: none; expression: smiling; strength: kind; weakness: shy,caacabe1-0abc-43af-92e2-2231248bff93,78c03081994c77644fd87a2048fc35490c7fc41c3f124a7000c6c1b73be971df
,46,pinky-monky-ponk,pinky monky ponk,She love to dance the honky tonk.,Female,hair: maroon; eyes: blue; teeth: none; clothing: linen; accessories: none; expression: smiling; strength: brave; weakness: chips,bd6a4b38-543e-40fa-9153-f7e1a947ebb1,acb5e17c78eccea9e99fd07e0732288ccc5c3cb2c45798e1fe9e095e521e8f30
,47,wanjiru-hippie-glitter,wanjiru hippie glitter,A hippie that loves her glitters.,Female,hair: blue; eyes: brown; teeth: none; clothing: wool; accessories: none; expression: smiling; strength: none; weakness: babies,683f0d27-3cb4-4948-b1b5-09f10bee575a,f15a46b8208b8ca25ed1597ad9e288a4256f5a8af3ef009d73f1fd6d00e23862
,48,njoki-binary-coder,njoki binary coder,She codes with the best language and tops the set.,Female,hair: blue; eyes: brown; teeth: none; clothing: ankara; accessories: none; expression: smiling; strength: none; weakness: none,9b59bdb4-0c6c-4107-9d72-6d38d308edb4,d82e95f3c5cd442437e209d155148a518bcc76959e04d9dcffe476f188e758cc
,49,wangu-calaba-hustler,wangu calaba hustler,She is a passionate hustler you should be careful with her.,Female,hair: blue; eyes: brown; teeth: none; clothing: ankara; accessories: none; expression: smiling; strength: brave; weakness: flying,67f7da93-3925-4def-b660-58f558c14a19,00cfadc514e26b45fe45fbbea7f3a5869017d5e17c62e1b61238f47ef03d6297
,50,lulu-dey-kpako,lulu dey kpako,She's is as enthusiastic as she is beautiful.,Female,hair: blue; eyes: brown; teeth: none; clothing: ankara; accessories: none; expression: smiling; strength: loving; weakness: makeup,23b6c38f-ab84-4565-bfe9-d9eb019c9f29,3f6428f3e74baca7e5cc4c31b8281700c22baa464107dd5294fdc903a69fba29
,51,kiki-cala-flier,kiki cala flier,She flies first class and gets the best deals.,Female,hair: blue; eyes: brown; teeth: none; clothing: ankara; accessories: none; expression: smiling; strength: brave; weakness: kittens,d24aefff-c9fc-4ea9-a7cf-1b741076c822,e63f91ae99cf1aeaa46bbf1b7cc6062e8aa605a02d7b8db8541c0f3f25f82d98
,52,purity-nft -investor,purity nft investor,She is an angel investor looking for the next big thing.,Female,hair: blue; eyes: brown; teeth: none; clothing: ankara; accessories: none; expression: smiling; strength: brave; weakness: clothes,ee86ef77-4793-411a-88d3-ea54d84f6b24,d3727d01ce57232e4592a0356dfcfcc66e8e8cf2b9b1dde788c862aa45b7fce3
,53,june-binary-monk,june binary monk,She has a twin from Tibet and they always play together .,Female,hair: blue; eyes: brown; teeth: none; clothing: ankara; accessories: none; expression: smiling; strength: brave; weakness: money,102c4cdb-f812-44fd-bf47-5065284c6075,8fdda0746c540536f8bca0521c97ac70e8455fcdc25faa5cb49acdce7f5c5142
,54,aisha-flying-damsel,aisha flying damsel,She is always a damsel in distress and loves to fly.,Female,hair: blue; eyes: brown; teeth: none; clothing: ankara; accessories: none; expression: smiling; strength: brave; weakness: food,c4071af3-b49e-4ad6-898b-7828f90465fb,9869f34da2fb4dcb14ec2c32cde45dde717d75ae51db9bcd3972f1c14463ebf0
,55,bobo-crypto-lovely,bobo crypto lovely,She is a crypto guru you can trust all through.,Female,hair: blue; eyes: brown; teeth: none; clothing: ankara; accessories: none; expression: smiling; strength: brave; weakness: water,427ea0f5-30a3-4d70-a5bd-a6106409b83c,729a46a9bbe27c7ef7bea5138d33bc30e4fbb830a0b7399131f469f3bf2dae74
,56,nell-light -embrace,nell light embrace,She is an empathy ready with a kind word or hug.,Female,hair: blue; eyes: brown; teeth: none; clothing: ankara; accessories: none; expression: smiling; strength: brave; weakness: love,9dfe30b4-c71a-471c-8091-f5c4a238eed8,5a92420d98e61205a33d4377cc5fb9ba80b3456b2b9edd5112255938d1b13cec
,57,rachel-mood-silent,rachel mood silent,Introvert  to the core a mysterious lady.,Female,hair: blue; eyes: brown; teeth: none; clothing: ankara; accessories: none; expression: smiling; strength: brave; weakness: walls,11450acd-f0d7-406f-bc18-bdb680404845,6698a4a0483f94e9a38a091f0fbdb0ea1fb6a20708a70533391c7280d5cdd9b6
,58,nana-reflector-agent,nana reflector agent,She loves her chrome fashion style.,Female,hair: pink; eyes: blue; teeth: none; clothing: ankara; accessories:none; expression: smiling; strength: brave; weakness: shy,63bda633-bfca-4b28-823f-7772936b4103,18d98a4603d4b8f8a210ce42cdac18696244448d2726601dd472322fd6871b3e
,59,bree-busy-gossip,bree busy gossip,Never whisper your secrets to her except you want the world to know.,Female,hair: blue; eyes:white; teeth: none; clothing: glitter; accessories:none; expression: frowm; strength:goodlistener; weakness:height,4f5898d9-fc99-4053-a56c-b2ec1ef41347,5dd8215b4214b7b48c9af726775a10433639b0d6b30aa59f18f8bf57d1f9690d
,60,jude-shadow-fighter,jude shadow fighter,A ninja warrior; the last samurai standing.,Female,hair: white; eyes:brown; teeth: none; clothing: ankara; accessories:chain; expression: smiling; strength:brave; weakness:water,a47b2ed7-d4aa-4404-ac40-0ecea464cf3f,6d0153f53d1dffa87ea9560f587120d294ec641445ffc5ca7e78f935b0017593
TEAM GRIT,61,toy-soldier,toy soldier,A man stronger than an army.,Male,hair: bald; eyes: closed; teeth: none; clothing: overall; accessories: nose mask; expression: happy; strength: powerful; weakness: sentimental,fc8ea3ac-59d1-11ed-9b6a-0242ac120002,bfda13347492198642472c9b94d71c297ba7c54b0f18cfb4622aa1f758bbfce9
,62,pipey-rivers,pipey rivers,A man who loves the water so much and fixes it's path.,Male,hair:bald; eyes: opened; teeth:none; clothing: overall; accessories: nose mask; strength: calculative; weakness: public speaking,58f69cae-59d1-11ed-9b6a-0242ac120002,785faac0dc828a9d231b2f287c9b5ded981697cede2481ada879d7bc15f9947f
,63,phiri-of-zambia,phiri of zambia,An african woman with strength and beauty.,Female,hair: purple buns; eyes:nose; teeth: none; clothing: adire; accessories: sunglasses; expression: jiggy; strength: free spirit; weakness: blind ,24b537fa-59d3-11ed-9b6a-0242ac120002,0be42f1f787edcdfb34a267af106b7d00f0d843683c997c5713dbac67ec8ae74
,64,patrick-of-bikinibottom,patrick of bikinibottom,A white man who loves the african culture and associates with their dressing.,Male,hair: bald; eyes: opened; teeth: none; clothing: kente; accessories: nose mask; expression: confused; strength: adaptation; weakness: fluency,064c7b84-59d3-11ed-9b6a-0242ac120002,131ee4aaa62cf323f1f2331ea56baedbed7ffd82310f06dfa2d98bf524e9d605
,65,nobuhle-of-zulu,nobuhle of zulu,A woman; well endowed with beauty.,Female,hair: brown bun; eyes: none; teeth: none; clothing: iqoyi; accessories: sunglasses; expression: astonished; strength: cool headed; weakness: pressure,1ee5b1ce-59d3-11ed-9b6a-0242ac120002,cca12984374684563b75ba2768c6659e52c60ba7abac7d838c1bf18936f31d21
,66,nkosazana-of-xhosa,nkosazana of xhosa,An african princess; always proud of her culture.,Female,hair: ginger afro; eyes:none; teeth: gap teeth; clothing:umbaco; accessories: sunglasses; expression: fufilled; strength: confidence; weakness: endurance,2f1a1724-59d3-11ed-9b6a-0242ac120002,82aa9f2d77039d5a2d35fd4aee71ab1308621fdc53ceeecfa88ede740402b7e2
,67,mandla-of-zulu,mandla of zulu,A simple and introverted guy who keeps to himself.,Male,hair: bald; eyes: opened; teeth: none; clothing: eshowe; accessories: nose mask; expression: irritated; strength: strong willed; weakness: relationship,d04553b2-59d7-11ed-9b6a-0242ac120002,1259adb7e0c68e6231b15728b25edda7fe78a5aa749b3a8797c33b813837d463
,68,john-doe,john doe,A principled guy who is conscious of his health and ensures protection from infection.,Male,hair: bald; eyes: opened; teeth: none; clothing: ankara; accessories: nose mask; expression: cold; strength: cleaniness; weakness: perfectionist,5d19795e-59d2-11ed-9b6a-0242ac120002,3f16695e5546b5e733bfe425ce220df1b3258936e29242c4dda08923ccb03acd
,69,ghost-of-power,ghost of power,A woman; stronger than ten men combined.,Female,hair: black tied with scalf; eyes: none; teeth: none; clothing: iqoyi; accessories: sunglasses and pipe; espression: ruthless; strength: badass; weakness: cancer,29c764ca-59d3-11ed-9b6a-0242ac120002,974f1e9ad5534b89ee812c9f8b436e928dcb764f80d6b50ef469b4d19fdca5b9
,70,freida,freida,A man who is always peaceful.,Male,hair: bald; eyes: closed; teeth: none; clothing: overall; accessories: nose mask; expression: calm; strength: peaceful; weakness: anger,ee671c4a-59d2-11ed-9b6a-0242ac120002,8eb6d40cee633fb4fa238b45b53fbd2518084889ecd97b5c9b48e314b4d8ad97
,71,flamboyant-tree,flamboyant tree,A beautiful african woman; billionaire in the making.,Female,hair: one bun dark brown; eyes: none; teeth: none; clothing: kente; accessories: sunglasses; expression: happy; strength: beauty; weakness: lover girl,380e4990-59d3-11ed-9b6a-0242ac120002,40261bbad2ff60992ec9a9871e67307ec0ac08c62084fec32bf0dde2381f1680
,72,david-of-accra,david of accra,A combatant who fights and defends his people,Male,hair: bald; eyes: opened; teeth: none; clothing: kente; accessories: nose mask; expression: angry; strength: super powerful; weakness: sleeping,1c1ef1b4-59d1-11ed-9b6a-0242ac120002,4936e98e343a375a88d7cf1df3a7561913eba6a02ccc2ac7382f6ce8e31b4609
,73,cally-lily,cally lily,A man who is a breathe of fresh air.,Male,hair: male; eyes: opened; teeth: none; clothing: overall; accessories: nose mask; expression: confused; strength: calm; weakness: sun,82bba87c-59d1-11ed-9b6a-0242ac120002,ce736060748140ae25c062d62a9e8c45b8714f7a0c95983a18b4e2933e85ad86
,74,bubune-of-accra,bubune of accra,A man with honor; always conscious of his health.,Male,hair: bald; eyes: closed; teeth: none; clothing: kente; accessories: nose mask; expression: happy;  strength: clean; weakness: foodie,faa4b530-59d2-11ed-9b6a-0242ac120002,3d82031962613831fcedd3b30edcbea6feb815d0d5aec8f64875066c01bb8588
,75,bediako-of-accra,bediako of accra,A strong man; always ready to fight for what is right.,Male,hair: bald; eyes: opened; teeth: none; clothing: balck with kente; accessories: nose mask; expression: suspicious;  strength: activist; weakness: irrational,fb6e8222-59d0-11ed-9b6a-0242ac120002,8af4c0e710dedfd2ea1549d58aa4482679925d8e9f1a30dc49c3518837a6aace
,76,avatar-aang,avatar aang,A man who is ready to save the world.,Male,hair: bald; eyes: opened; teeth: none; clothing: kaftan; accessories: nose mask; expression: soothing; strength: mind games; weakness: insomia,169f93a0-59d2-11ed-9b6a-0242ac120002,bb4a53922148ceb11e23aae2092fd8f75bee8b9f77e7ddb0568c4ddcbb091e51
