TEAM NAMES,Series Number,Filename,Name,Description,Gender,Attributes,UUID,Hash
,300,tamuno-the-prince,tamuno the prince,An Ijaw prince who is also the heir to the throne,Male,hair: covered; eyes: sky-blue; teeth: closed; clothing: akan;  accessories: cap; expression: straight-face; strength: caring; weakness: easily deceived,108447d1-f2d5-4816-8ebb-599286c3fabf,a720dfc1828469c6d24c27a02b952bd2159bfc62f9423a55dce28cb1c4f304c9
TEAM SCALE,301,wendy-the -banker,wendy the  banker,"Wendy loves working in the bank, as she gets to meet different people.",Female,hair: dark red   eyes: blue  teeth:none  clothing: blue and yellow ankara   accessories: none  expression: shocked  strength: none   weakness: none ,587645e2-5ace-11ed-9b6a-0242ac120002,ef0a5a5e108679c87ebb5d52c3f6f24945a2144f8cf795424bc809dfe671de91
,302,uduak-the -dark horse,uduak the dark horse,Uduak looks innocent and has the whole apartment bugged,Female,hair: brown   eyes: blue   teeth:none   clothing: multi-colored ankara  accessories: none  expression: witty  strength: none   weakness: none ,58764862-5ace-11ed-9b6a-0242ac120002,fc9e139a5fb0651e1ceace9398e7e2833bd234c88689c55876386a7f2e134c43
,303,timeyin-the -eccentic,timeyin the eccentic,Timeyin is as eccentric as they come with no care for others opinions,Female,hair: brown   eyes: blue   teeth:none   clothing: multi-colored ankara  accessories: smoking pipe  expression: high  strength: none   weakness: none ,58764a2e-5ace-11ed-9b6a-0242ac120002,0b3266ce4ff2fa5358c3a128dd9ace1212a8b49cf2a6e53a136a577f4eb80ab7
,304,omawunmi-the -businesswoman,omawunmi the businesswoman,Omawunmi is a no-nonsense woman with a shop in idumota,Female,hair: pink   eyes: blue   teeth: white teeth   clothing: yellow ankara  accessories: none  expression: angry  strength: none   weakness: none ,58764b78-5ace-11ed-9b6a-0242ac120002,ca9290b3a4421b91614c78af1ecb20e447a9a19f73fa5d812f083ff72ceabad5
,305,halima-the-housewife,halima the housewife,Halima loves to bake and cook for her children,Female,hair: brown  eyes: blue   teeth: none   clothing: ankara designed with yellow; red and green  accessories: none  expression: tired   strength: none   weakness: none ,58764d8a-5ace-11ed-9b6a-0242ac120002,176c8fda39ebcef178f6943ab09b4b53dfe82bea1ff76eed9a23c563d2dd90fa
,306,muna-the -block sister,muna the block sister,Muna loves to tell everyone in the block about her younger escapades,Female,hair: black  eyes: blue   teeth: none  clothing: wolf-skin ankara  accessories: headgear  expression: shocked  strength: none   weakness: none ,58764ea2-5ace-11ed-9b6a-0242ac120002,be606271bb2ffb1cd3e4013785c2d2cfb55ef2e5c8222fdc050f0cef53cbf5c2
,307,stella-the -gossip,stella the gossip,Nobody gossips on the block like stella when smoking.,Female,hair: red  eyes: covered eyes  teeth: none  clothing: black ankara with bright design   accessories: none  expression: calm  strength: none   weakness: none ,58764fd8-5ace-11ed-9b6a-0242ac120002,3507b887bd9f54496e1012b8c957b4468c623c3d7ea53aa69c3a9ae7875daaf6
,308,agbani-the-wannabe,agbani the wannabe,Agbani loves to shop antique decorations for her mansion in idi-iroko,Female,hair: purple hair  eyes: covered eyes   teeth: none   clothing: blue one-armed dress   accessories: none  expression: happy  strength: none   weakness: none ,5876542e-5ace-11ed-9b6a-0242ac120002,d366d28d1a6e89061acd2d63fe594786d9cb6c629a65cc48fef71bd0293a3117
,309,asante-the -warrior,asante the warrior,Asante came from a long line of warriors in Ghana,Female,hair: pink braids  eyes: covered eyes   teeth: none  clothing: one-armed brightly colored dress  accessories: none  expression: calm   strength: none   weakness: none ,58765578-5ace-11ed-9b6a-0242ac120002,a947c055297f4989485aae71c10b9537cbbc1e6c0cfcb00324603871ce80321c
,310,hilda-the -insomaniac,hilda the insomaniac,Hilda prefers to sleep during the day.,Female,hair: pink   eyes: covered eyes   teeth: none   clothing: multi colored ankara   accessories: none  expression:calm   strength: none   weakness: none ,5876569a-5ace-11ed-9b6a-0242ac120002,f0103a1758265801d90849d254c0facf0b2b3c711ae6ff12b13e4c58140bbd60
,311,sisi yemi-the -street aunty,sisi yemi the street aunty,Sisi Yemi is everyone's favourite street aunty.,Female,hair: dark brown   eyes: brown eyes  teeth: none   clothing: blue and yellow ankara  accessories: none  expression: shocked   strength: none   weakness: none ,587657a8-5ace-11ed-9b6a-0242ac120002,8240b87ce498aaa4ead61f18eb0d7ea517cc20794da91329c7f2dd970b760264
,312,chiamaka-the -bully,chiamaka the bully,Chiamaka hates people in her business and likes to scare the kids on the block,Female,hair: pink  eyes: brown  teeth: none  clothing: multi-colored ankara  accessories: smoking pipe  expression: strong  strength: none   weakness: none ,587658ca-5ace-11ed-9b6a-0242ac120002,3663be96e33de247fd6a3d19d49865e99813c83d26fda974d53e8313099a7df3
,313,gift-the-fashionista,gift the fashionista,Gift has always been bold and that spreads to her fashion sense too.,Female,hair: brown   eyes: brown   teeth :none   clothing: multi-colored ankara  accessories: none  expression: witty  strength: none   weakness: none ,58765adc-5ace-11ed-9b6a-0242ac120002,0c063f95c94870b523ad0aff6b123c7f0fb3e7f5c108f38e311e2666df8c54ef
,314,omoyene-the-weirdo,omoyene the weirdo,Omoyene likes to murmur to herself and talks about seeing ghosts,Female,hair: brown  eyes: brown  teeth: none  clothing: yellow ankara  accessories: none  expression: calm  strength: none  weakness: none ,58765bea-5ace-11ed-9b6a-0242ac120002,24ad2df2d2acca78f6f1b6618e97b6ddf24bb025afeb218c909bb42464ede6ee
,315,maria-the -freshface,maria the freshface,Maria likes to believe the world is sunshine and rainbows while blowing gum,Female,hair: pink  eyes: brown eyes  teeth: white teeth  clothing:yellow; greem and red ankara   accessories: none  expression: furious   strength: none   weakness: none ,58765d02-5ace-11ed-9b6a-0242ac120002,1de48f0a8343f798d68d8a83db27d86a08052052bf369e8002e1772258b42270
,316,monica-the -smoker,monica the smoker,Monica is never found without a pipe and loves to interject in every conversation.,Female,hair: grey   eyes: covered eyes  teeth: none  clothing: black ankara with bright designs  accessories: yellow glasses  expression: hip   strength: none   weakness: none ,58765e24-5ace-11ed-9b6a-0242ac120002,7b568abbdc78fd3c821144bf6951c9283097945b59edd0099e1d041036a43fb6
,317,janet -is always -found singing ,janet the singer,Janet is always found singing in whatever activity shes doing,Female,hair: purple   eyes: covered eyes  teeth: none  clothing: yellow and blue ankara  accessories: yellow glasses  expression: cool  strength: none   weakness: none ,cef902bc-5afc-11ed-9b6a-0242ac120002,c50db67648c0fd99ec8d078b989b15a0b3130aac6fbc04b2d4209937b2ff6c9f
,318,emi-the-reggae-girl,emi the reggae girl,EMi is a beautiful dancer; she rules the reggae world.,Female,hair:pink braids   eyes: covered eyes   teeth: none  clothing: multicolored ankara  accessories: yellow glasses  expression: happy  strength: none   weakness: none ,cef9060e-5afc-11ed-9b6a-0242ac120002,d033a7298fae98c69507045f4a996ab87aeb8a33352b89e396d9b8524b6e8cd5
,319,aisha-love-the-life-of-the-party,aisha love the life of the party,Aisha always party during the weekend,Female,hair: red   eyes: covered eyes  teeth: none  clothing: wolf-skin ankara  accessories: yellow glasses  expression: hip  strength: none   weakness: none ,cef907a8-5afc-11ed-9b6a-0242ac120002,ccabfcb8c0f8477226aad689c62bc9e7f851bea086d207adddb4360aafbaeb67
,320,amaka-the-tailor,amaka the tailor,She sews the most beautiful dress in the hood,Female,hair:grey  eyes: covered eyes   teeth: none  clothing: black dress  accessories: yellow glasses  expression: happy  strength: none   weakness: none ,cef9091a-5afc-11ed-9b6a-0242ac120002,de2074f07c17a189b4d2ce2ab3644bdc7d61ee01ea95f0cd024dcfed258a6847
TEAM SANDPAPER,321,omunyinyi-the-stoic,omunyinyi the stoic,omunyinyi wears a Kitenge coat,Male,hair: bald eyes: tearyteeth: noneskin: brownskinclothing: checked ankara accessories: none expression: teary strength: powerful weakness: self-loathing,c2d6a3ac-1d4d-4268-ba7f-4f0f8f50c1ab,df18400809f5027ccd11fb01c575a23409669ed25f7e331a8047678269fa0b93
,322,kamau-the-sleeper,kamau the sleeper,closed eyes meditating,Male,hair: blad eyes: closed teeth:  noneskin: brownskin clothing: black ankara accessories: none expression: flat strength: open to suggestion weakness: always sleepy,20330f5c-40c2-4f6a-b9d8-d1d04fb97daf,2255d83d47623c2b7203055ebb41b64c4ab2e7343f48edfadc0dbdba538fe8db
,323,mutiso-the-lastborn,mutiso the lastborn,masked up mutiso dozing off,Male,hair:bald;; eyes: closed teeth: none skin: brownskin clothing: yellow ankara accessories: none  expression: tired strength: consistency weakness: pessismist,0706c338-42eb-4d26-84ea-c24b39628200,2043dab2b36981d97d690c61fc26f16d68a7edf1a72e5c3f800383f32883ec31
,324,omondi-the-vegeterian,omondi the vegeterian,omondi wears a green coat,Male,hair:bald; eyes: sharp eyed teeth: none skin: brownskin clothing: green ankara accessories: none expression: alert strength: leader weakness: anxious,bfb5e8d5-d7a7-4aa8-85e8-d7d9afd4adb3,9ced8e6f87b2a13ff7115acd86b13100192bb156696bb39c1d9617c418ef83c2
,325,barasa-the-optimist,barasa the optimist,looks up to the sky and makes a wish,Male,hair: bald; eyes: blue teeth: none skin: dark skin clothing: brown ankara accessories:none expression: awake strength: strong willed weakness: immoral,2da4bef4-38cc-4414-99ad-7361fac04b2b,e9a3dc415bf8f3677fb83c55465dddaa4bb1f1f9243d8bc0ed73af1aee2aa80d
,326,mwembu-the-elder,mwembu the elder,"old but not so old, with yellow his favorite color",Male,hair: bald; eyes: black teeth: none skin: dark skin clothing: dark ankara accessories: none  expression: plain strength: fulfilled weakness: angry,36181230-6ac9-417f-af5c-23bdd2c25ecb,725b54f69ba5bafc1c2328359abeeefb08ae7871208cf38fbae8cc459b9fdc73
,327,mbogi-the-fighter,mbogi the fighter,masked up mbogi after capture,Male,hair: bald;eyes:  blackteeth: noneskin: darkskin clothing: onesideankara accessories: noneexpression: willfull strength: fighter  weakness: rebellious,3a7bc3c4-1463-42ce-84c9-07337da64435,82082fb7aa9a133752086c689bc565874f9b1eb9450a4b4bbe8713d48343cc7a
,328,mrosho-the-runner,mrosho the runner,masked up mrosho,Male,hair: bald; eyes: sea blue teeth: none skin: darkskin clothing: purple ankara accessories: none expression: alert  strength: visionary  weakness: destructive,b2ca2c76-3b6d-43f1-8cc9-089b6ab83876,a8bfcbfaca7a331ccb5fb5d24d2383f4796d3941daefd3675812f004f70472ac
,329,milele-the-african,milele the african,milele with a nice african print in orange,Male,hair: bald; eyes: blue teeth: none skin: dark skin clothing: orange ankara accessories: none expression: timid strength: leader weakness: failure,644b0259-d75c-456d-934c-ce7c052bad3a,6f49b029f6476e03e3be4b24084e1d50d5e811eec71e3012eaba5a80c4edde37
,330,olebon-the-oloibon,olebon the oloibon,olebon in customized buba sokoto,Male,hair: bald; eyes: closed teeth: none skin: darkskin clothing: animal print accessories: none expression: surprised strength: empathy   weakness: easily bored,de261efe-731d-461e-b2e4-42edd2f48f72,5936876865a2b1af5caef760fd6ee276b3694c97655273325444fbcfcef39caf
,331,chifu-the-maasai,chifu the maasai,clothing inspired by maasai shuka,Male,hair: bald; eyes: closed teeth: none skin: none clothing: ankara shirt accessories: none expression: visionary strength:  authentic weakness: selfish,239933c4-7177-4b5b-86e8-e6f952301344,40342d4e9a5cd564fbe91b021bb114cc0d0141682528e5badff6f925f3901985
,332,mwangaa-the-voice,mwangaa the voice,mwangaa the chief,Male,hair:  bald; eyes: blue teeth: none skin: darkskin clothing: white lined ankara accessories: none expression: kindness strength:  brave weakness: impatient,49179b62-812d-4d0f-b518-4af7fa79f8bc,26d64b5e7599ae5d489374832316451cf9837ffbb402bcdb972da0baee02ebb2
,333,waforte-the-first,waforte the first,masked up man who does sleep a lot,Male,hair: bald; eyes: closedteeth:none skin: darkskin clothing: jean ankara accessories: none expression: shy strength:  weakness: selfish,871912a8-d96e-4594-b7b3-450d94ee6924,a2410a46262e8e2a70de53c4b3865cea39ad1167b4e1a5aca5541b8778420f34
,334,kariuki-the-prayerful-one,kariuki the prayerful one,kariuki closes his eyes,Male,hair: bald; eyes: closed eyes teeth: skin: clothing: accessories: expression: bored strength: intelligent  weakness: passive,6a5b6fa6-0f91-4b01-957f-c766945eb704,b04b2082d0b99e013a79fc71941067b34aee142a82a1e21b74023e4cd2b0f687
,335,kenyanese-the-priest,kenyanese the priest,masked up man with with white cloth,Male,hair: bald; eyes: white teeth: none skin: darkskin clothing: white jean shirt accessories: none expression: calculative strength: kind weakness: takes things personally,0706c338-42eb-4d26-84ea-c24b39628200,51fb1214ffd634e983d8e9033f105cda15adfafae510d46ba9631198e4c6abfd
,336,nyimbo-the-singer,nyimbo the singer,glasses and a pot for the night,Female,hair:dreadlocks; eyes: glassed up teeth:none skin: brownskin clothing: off shoulder ankara accessories: a pot expression: free spirited strength: fair weakness: impatient,d05af807-b3e9-4ad3-8df1-b7864d2daa33,ea10ec2a11e7189cb5de1d3e4ffefeaa31b7a30f6cf1b76ccabb4e63176ff275
,337,maathai-the-nobel-winner,maathai the nobel winner,mathaai the warrior,Female,hair: pink afro; eyes: glassed up teeth: none skin: brownskin clothing: colored ankara accessories: noneexpression: strict strength: leadership  weakness:short sighted,0871cb8c-8d56-445d-92c7-01793f327707,e639ddc16e0de6f046c3ae1557a877492ff61c2dbd729100dcf2a1914052b350
,338,tish-the-angry-one,tish the angry one,angry tish with specs on,Female,hair: black huge afro; eyes:  none teeth: broken teeth skin: brownskin clothing: offshoulder ankara accessories: none expression: disgusted strength: blunt weakness:greedy,750a89dc-44ff-43bf-8211-b7776f1b5e52,f74a6e731918831f39e3c52f5e7b8965c96906233303c4147166fc934ad083ad
,339,wamenza-the-winner,wamenza the winner,wamenza the leader,Female,hair: laid back; eyes: none teeth: none skin: brownskin clothing: offshoulder ankara accessories: noneexpression: meditative strength: strict weakness: impulsive,7348c9ed-4ac9-4785-9434-0a1f0dcaf8d8,8766e54a128d5be423be782170708a69c9e2e8f0356f0c0471306283ea416971
,340,isaya-the-track-king,isaya the track king,isaya the traveller,Male,hair: none eyes: glassed up teeth: none skin: brown skin clothing: bright ankara accessories: none expression: taken aback strength: straight forward weakness: selfish,41781a16-d2b8-4fc6-a1f4-b9fffc5c95ba,cbcf3c8ed13264ce2484cda03842002f70d3cf91e5d0d981c75d18e3dbeec11e
TEAM RULER,341,mansur-the-partyrider,mansur the partyrider,Mansur is the life of a party and never caught dulling.,Male,hair: none; eyes: ash grey; teeth: none;  clothing: agbda; accessories: studs; expression:happy; strength: intelligent; weakness: red whine,78db0f29-3936-4d9c-bb90-3dbf20dba2dd,3cbd7097514e8d3d10a04b8384c04f35d139108043cb60dbfa7e975b569641a5
,342,tola-the-businessman,tola the businessman,Tola loves business and owns several shops in Idumota.,Female,hair: none; eyes: midnightblack; teeth: none;  clothing: purple blowse; accessories: mask; expression:furious; strength: powerful; weakness: love,1c5d5a6b-cf04-4bf9-978e-22a7e9bc5819,e1c32bdc7abb6ed381a2d7a964b2c6afbbadf7bdd92b3ebd084fed7ed3e95378
,343,abdullahi-the-honorable,abdullahi the honorable,"Popularly called ""buje budanu"" a godfather who lavishes money on young gees.",Male,hair: none; eyes: blue-blackish; teeth: none;  clothing: yoruba attire; accessories: none; expression:anxious; strength: foreseer; weakness:indecision,dd708276-445f-4483-8357-fc08e999328f,1f67b1dc71347af58873ba752c7602d79ab6db2aeeefc7358d3dac481a4ce66d
,344,ojukwu-the-badguy,ojukwu the badguy,Ojukwu is a business minded guy but fun to be with.,Male,hair: bald; eyes: eagle eyeball; teeth: none;  clothing: yellow lining blowse; accessories: none; expression: none; strength: good eyes for fashion; weakness: lack will power,76c1eabf-15ea-446a-8426-472982c4d800,604694f468e7f8e5a5828cd77ab2f6a0df53c1c706c877fc2a644e8fc1963d95
,345,odunsi-the-egbonadugbo,odunsi the egbonadugbo,Odunsi loves to advise and people in the community rely on him.,Male,hair: none; eyes: dark brown; teeth: none; clothing: one shoulder gown; accessories: none; expression: none; strength: elegant; weakness: easily depressed,2912ab8b-5875-4277-a5c2-a0209aee90ae,d74a03065782d96b279764025a22174d60add2bbd30ed39ccfdf572adf351095
,346,ogogo-the-sugardaddy,ogogo the sugardaddy,A rich oil magnate who loves to solve young women's problems with his millions.,Male,hair: none; eyes: cat eyes; teeth: none; clothing: purple danshiki; accessories:nose mask; expression: straight face; strength: brave ; weakness: too selfless,aa575f30-04ad-45f9-a798-199465117793,2dd6239907c529c4031fa36cb8e33871d29218764f09d5009dfbfbfc3c497a36
,347,suli-the-amalaseller,suli the amalaseller,Suli sells amala with respect and people say that's the secret to her sweet food.,Female,hair: low punk; eyes: cat eyes; teeth: none; clothing:brown babarigai; accessories:none; expression: furious; strength: wealthy; weakness: too emotional,46fd4821-04dd-4f65-9290-c130a00c4c93,1c87284ee109826ca137e9bc44b9b0ea7144046267ab903b0b2527521fbf9c29
,348,dolapo-the-afrocentric,dolapo the afrocentric,Dolapo loves African prints and loves to showcase culture.,Female,hair:bald; eyes: brown; teeth: none; clothing: one sided blowse; accessories: nose mask; expression: none; strength: beautiful; weakness: forgetful,cbab232b-5c62-4df8-867b-018a2e496cd4,0a3b5a73a0391c31535bf43223b60f07cc0d199a6b80252a08367601dfc30f51
,349,danjuma-the-saddist,danjuma-the-saddist,Danjuma is a grumpy man no one likes to associate with him.,Male,hair: none; eyes: sky blue; teeth: none; clothing:purple agbada; accessories: neck beads; expression: excited; strength: outspoken; weakness: boring,5a42af57-186e-425b-b6b1-f72bda4911ef,c461a270e29ac00edbc36825b396fe98225fc765613d815151291e68f76e40b5
,350,chinedu-the-farmer,chinedu the farmer,A hardworking farmer who has 6 boys who help out on the farm.,Male,hair: none; eyes: black; teeth: brown; clothing: one sided gown; accessories: none; expression: blushy; strength: easily loved; weakness: get angry easily,9e8a55d7-0d8d-465d-a628-08ddd387a2c6,142e68ceb1ae30dbb53012eae6031ce583a5f1ae14ab85a3728db944ef5ef72c
,351,kola-the-baldguy,kola the baldguy,Kola is every girls dream man because of his hair style.,Male,hair: low cut; eyes: mouse eyes; teeth: none; clothing: gbariye style; accessories: nose mask; expression: unhappy; strength: good eyes for details; weakness: sluggish,c32f1757-da9c-49e8-bd79-510a42b6971a,0b0dad0c8f159d9cd244582c7f952a88bcd69e23e6503050e8b4004bb715f1b2
,352,bola-the-bosslady,bola the bosslady,A lady who supports the boy child by providing scholarship to young talented males.,Female,hair: low cut; eyes: brown; teeth: none; clothing: short orange gown; accessories: nose mask; expression: none; strength: industrious; weaknes:spend lavishly,09ff910d-a2be-49d5-8b27-b9378458701c,456b3a95aeb7a39452d54a3fd5bb2793883e027edbb4dcb958cabda8cdf16f20
,353,kunle-the-alienguy,kunle the alienguy,Kunle is special and easily get noticed even in the midst of crowd.,Male,hair: green punk; eyes: green; teeth: none; clothing: purple agbada; accessories: purple beads; expression: unbothered; strength: very energetic; weaknes:eaaily give in,dea2f5d8-e3ba-4d3f-9a17-0a7edfd0c100,1bab9c7c6d2e051311752c5993d49b260e10133383b5b6bd99001d6453367798
,354,segun-the-sharp,segun the sharp,Segun drives with caution and people love him for that.,Male,hair: green punk; eyes: black ; teeth: none; clothing: orange buba; accessories: nose mask; expression: bitchy; strength: team player; weaknes: none,f9159a9c-f48d-4aee-bcc1-63c86209f806,3cc4b78c216f00666d45ecd6201cfd84d2d87718f59602a5981e7b7d99e4ab7a
,355,ola-the-hardguy,ola the hardguy,Ola may be feared but he is such a coolheaded champ.,Male,hair: none; eyes: closed eyes; teeth: none; clothing: purple buba; accessories: none; expression: sick; strength: quick recovery power; weaknes: get ill frequently,a814fc77-bdfa-4e50-8ba8-3e4e4bcfb3c0,361b45657ddce5da18fa6f5d3fbdaf592c6881784654a49360bf5706949d2492
,356,emeka-the-chief,emeka the chief,Crowd are always at Emeka's house because of his selflessness.,Male,hair: none; eyes: closed eyes; teeth: none; clothing: pakaja attire; accessories: none; expression: bossing; strength: easily comman respect; weaknes: not a ladies man,195e89c8-0b6f-43ad-9a2c-d20f03439e96,5d8c04b86f8cd0ea7cb0164d9165b0d3b056b0eade4d3817fd1c99356a5cfc6d
,357,ugochukwu-the-celeb,ugochukwu the celeb,Ugochukwu is an online celebrity with many followers on social media.,Male,hair: white blode; eyes: closed eyes; teeth: closed teeth; clothing: black gown; accessories: gold shades; expression: bitchy; strength: enterprising; weaknes: too emotional,74775cda-cff4-4d21-8819-693127598eca,eeb649038035ab48893df6169c19668e2f6193e971f4dc05a6af265b550343c6
,358,adekunle-the-yorubademon,adekunle the yoruba demon,He might be every woman's man but faithful and loyal to one.,Male,hair: gobi cap; eyes: closed eyes; teeth: closed teeth; clothing: ghana dansiki; accessories: gold shades; expression: owanbe mood; strength: from a walthy home; weaknes: disrespectful,5c98c2d8-3144-4e08-8a0f-9b8d7e4f5aa7,c74334c814c76727db3386b26e2c95fa7f64f57a827cf3627ae412abd7d698e2
,359,favour-the-fashionista,favour the fashionista,Combining dresses is not a problem for Favour.,Female,hair: black ghana weaving; eyes: cat eyes; teeth: none; clothing: senegalese blowse; accessories: gold shades; expression: party rider; strength: smart; weaknes: lazy,19fc15c3-80fe-4d45-a2fe-be8f087d57c4,1076fdd4ed59c603f22895564b379c80874ae871999e747ca7eea9cda87bf940
,360,jane-the-slayqueen,jane the slayqueen,Jane is always found in the midst of men and loves partying.,Female,hair: long grey braids; eyes: closed; teeth: black lips; clothing: black short gown; accessories: gold shades; expression: happy; strength:very intelligent; weaknes: have mood swings easily,74775cda-cff4-4d21-8819-693127598eca,6e7d9ebeb3d6c82bc76b1b0605d49904c7af1d83785a5da466bea8568ec1e809
TEAM VBELT,361,osas-the-ceo,osas the ceo,Meet Osas; a Gen-Z CEO with the British accent.,Female,hair: purple dreadlocks;  eyes: none; teeth: none; clothing: danshiki;  accessories: gold glasses; expression: none; strength: none; weakness: none,b10f7e42-4778-49db-820b-dabbad75504a,bbddd67877faf260c57b0ba4ac0eaf369c01707026774f478118a561dea53616
,362,nneka-the-rainbow babe,nneka the rainbow babe,Nneka; the happy rainbow babe with the vibes.,Female,hair: pink;  eyes: none; teeth: none; clothing: blue and black bichrome; accessories: gold glasses; expression: none; strength: none; weakness: none,e7e20ab8-03e0-4e0a-80aa-6e193f84426e,2f8b3b273dc7a81c7a75fd80c0948f9c68d49d13b5f21a6cfa40704f7a83f6ea
,363,temitope-the-spoilt girl,temitope the spoilt girl,Temitope; our favourite daddy's girl.,Female,hair: none; eyes: none; teeth: vampire teeth; clothing: right one-shoulder wax print; accessories: gold glasses; expression: none; strength: none; weakness: none,10cbcbcb-754e-4175-b85d-d0c7eafa16a2,496ef2d156e9a7ab0abddd717b264f97403206801e0979d09ded83b4dbe892db
,364,bekeh-the-party animal,bekeh the party animal,Baby Bekeh is life of the party that goes home with your charger.,Female,hair: dark brown;  eyes: none; teeth: none; clothing: left one-shoulder wax print; accessories: gold glasses; expression: none; strength: none; weakness: none,f0558235-3043-46e5-b26c-5bde83cc67fb,25cd5233b67ab4b71e66ab8831bceaf59583ad56f00175d2f321c197104ae7f5
,365,nana-the-tech lady,nana the tech lady,Nana; the tech madam that doubles as Kumasi Adele in her bathroom every morning.,Female,hair: black; eyes: none; teeth: none; clothing: print kente;  accessories: gold glasses; expression: none; strength: none; weakness: none,e0858913-7050-4c4a-a2a0-442a88463334,cebc93b6dcfe7752225df925fb316a2f6747f0376fe0dda99489b53fcc89ff73
,366,rofiat-the-marketer,rofiat the marketer,Rofiat; the distressed marketing intern.,Female,hair: purple dreadlocks; eyes: brown; teeth: none; clothing: danshiki; accessories: none; expression: none; strength: none; weakness: none,1e4d9bda-f6f9-4e7a-9381-bee4b074b56d,f3295df0a27e9b28acd25f0ae07130593cc1deeb9d30b62daeb13e7fb2aed7f3
,367,zarifa-the-righteous,zarifa the righteous,Meet Zarifa; a proper baddie for Christ.,Female,hair: pink; eyes: blue; teeth: none; clothing: v-neck original kente; accessories: none;  expression: none; strength: none; weakness: none,c6955d16-c343-46bc-9bed-c069ea8cc65a,b0d47521bb34a2b2a3de94a75e3d23492e6bcbda4e52de403fa78baa1bba5f21
,368,modinat-the-troublesome,modinat the troublesome,Modinat; The queen of gbas gbos.,Female,hair: long maroon hair; eye: none; teeth: vampire teeth; clothing: right one-shoulder wax print; accessories: brown glasses; expression: none; strength: none; weakness: none,49eb44e8-1117-463b-b7b3-1bcea4258362,6f1662d524ec475edf610a664954cee0cf76097a2b1f5430cb9928d645ee31a6
,369,amaka-our-mummy-g.o,amaka our mummy g.o,Here's Amaka; our one and only mummy G.O who's been to hell and back.,Female,hair: dark brown; eyes: blue; teeth: none; clothing: blue v-neck wax print; accessories: none; expression: none; strength: none; weakness: none,853edc40-0f9d-40c5-ba78-46067dfd7f68,46687c817dc2e65cc35f5f22b1c04fae36ea1b46c2a90bc377e533bd56ea6bac
,370,mawusi-the-patient,mawusi the patient,Meet Mawusi; the sweet sister waiting for her Canadian bobo.,Female,hair: black; eyes: blue; teeth: none; clothing: print kente; accessories: beret; expression: none; strength: none; weakness: none,ca9ddc30-141a-493d-851b-71d34f599641,b5ad0be678233fbc69d40ac8212e921a458e08dfe4bf077d04b45aa1311ac420
