TEAM NAMES,Series Number,Filename,Name,Description,Gender,Attributes,UUID,Hash
,152,nekesa-the-brainbox,nekesa the brainbox,A proposed elite who cannot write a simple speech.,Male,hair: black and red hat;  eyes: none;  teeth: none;  clothing: monostrap black ankara with yellow and red patterns;  accessories: none; expression: playful;  strength: none;  weakness: none,7ba909bd-19a1-454d-a86c-a45e85cb94a6,f41dcb2ca022df258a6df169e3e817f257069c7ab74735530532022adbff1181
,153,kiokoli-the-slowrunner,kiokoli the slowrunner,Always running in every race but never making it to the first 5.,Male,hair: black and yellow cap;  eyes: none;  teeth: none;  clothing: maroon agbada with yellow accents;  accessories: none;  expression: clueless;  strength: none;  weakness: none,d7027b6c-ae53-4cce-b80d-67aeb7ceb1ba,421b2629ed321a8fe9798454b3710ef4aa60683ad40c5263cfe56fe720e03943
,154,adjuani-uncle-wire-wire,adjuani uncle wire wire,Mugu money spender that loves spending on women extravagantly.,Male,hair: red cap;  eyes: none;  teeth: none;  clothing: plain and patterned ankara shirt;  accessories: none;  expression: anxious;  strength: none; weakness: none,36cd959f-d280-41f6-af76-765715c72527,fc448edba091030a732b1fe33e6d3f6c4846cd2a396b536c6f962309227abe54
,155,ajobaru-a-creative-artist,ajobaru a creative artist,A lovely artist who is known for creating magical art pieces that can spark a smile.,Male,hair: black and yellow fila cap;  eyes: none;  teeth: none;  clothing: yelow kente shirt;  accessories: none;  expression: cheerful;  strength: none;  weakness: none,9d262f55-73d7-4b95-9a82-42356dbb085c,9ae9981422083af0a503917463f2f0a2b682eb6bef0b789bdf948cb2a9007c2b
,156,effiadem-the-fireman,effiadem the fireman,A retired military general who always loves shooting at sight.,Male,hair: brown;  eyes: none;  teeth: none;  clothing: black and kente agbada; accessories: none;  expression: high; strength: none;  weakness: none,a4534fe0-b5ed-41ab-af72-1f2d0ff0fc64,f3c0424b2421878e08f9961165ff9b7051baa69df9b240b0cd8d36910baa490a
,157,deladem-the-commandoo,deladem the commandoo,The nerd who has watched all war movies but cannot fight a kid.,Male,hair: burgundy cap;  eyes: none;  teeth: none;  clothing: black and kente agbada;  accessories: none;  expression: none;  strength: none;  weakness: none,88106b92-da30-46ad-a3cc-d528683b9e33,e17d9cb97a99fa133fdbbc984c672ff178aafab041d3abb7f7117d29a62ae058
,158,dogbeda-the-monger,dogbeda the monger,A fisherman who pracitically live in the river.,Male,hair: orange and cream cap;  eyes: none;  teeth: none;  clothing: orange and blue denim;  accessories: none;  expression: unbothered;  strength: none;  weakness: none,66a09968-cb92-4378-a588-49947f68c537,7a75befc992ae5cce17477b3633a1e6c99d6c0f06f15505ae05fffba64cf1b40
,159,enyonyam-our-slay-mama,enyonyam our slay mama,Posts new pictures everyday and can snub for africa.,Male,hair: blue cap; eyes: none; teeth: none; clothing: green top with overall; accessories: none; expression: none; strength:none; weakness: none,5e7c7f9d-d631-4759-9b27-cbaccd33d39f,8ebbe14aee5e4641edc3ed17130ca0250f27882d0453f84d9c49136d32899b2e
,160,lumusi-pro-technician,lumusi pro technician,The electrician well known for wiring burnt buildings.,Male,hair: red hair; eyes: none; teeth: none; clothing: white top with blue overalls; accessories: none; expression: high; strength: none; weakness: none,b07676a6-c611-410d-8426-46c9c525189a,312b4ea1776afcd9ccc1eed1686ee91a4428e4a4e77441be0f937113c7622744
TEAM HEADLIGHT,161,funmi-the-fashionist,funmi the fashionist,Funmi enjoys fashion and she always takes opportunity to showcase her wardrobe.,Female,hair: black hair; eyes: none; teeth: none; clothing: aso oke; expression: cool; accessories: head tye and eye glasses; strength: fashion; weakness: men,4f9d99a4-78a2-4fdd-bc30-b027600fa88e,6bf479300971bd7cd6e83292dbe3c48a4c047bb8dc5e52ce71668a8822d5e1f2
,162,bola-the-funky,bola the funky,Bola is a funky fellow but she has another personality no one knows.,Female,hair: purple shuku; eyes: none; teeth: none; clothing: adire top; expression: neutral; accessories: eye glasses; strength: caring; weakness: snake,ac721b71-cbc5-425c-851f-ee826973f0b9,67fa09ae1c26a9757cc2afe5d7bf8ac8ccf1c02d1b2e1c95b46e80cbc6a65243
,163,bimpe-the-runzgirl,bimpe the runzgirl,Be careful with Bimpe because she cac be sensitive.,Female,hair: purple dreadlock; eyes: none; teeth: none; clothing: one arm ankara; expression: mischievious; accessories: eye glasses; strength: humanitarian; weakness: opposite sex,eaa7662f-6926-468a-9add-e791916ae42b,b31382ad0a26dcac04e567466565039a517df1d8298ca65c95e0813cbec6a73b
,164,sola-the-queen,sola the queen,Sola is a princess as she's got the mind of a queen.,Female,hair: brown long hair; eyes: none; teeth: none; clothing: blouse top; expression: cool; accessories: eye glasses; strength: Strong character; weakness: beauty,d5f23ad3-832a-4d3e-814e-e23f466d18a4,19207463340feca5f7fbe03aa27e6d00d6dfd32912b62075fc41c57476e4d700
,165,temi-afro-girl,temi afro girl,Temi is know for her funny haircut and this time afro is up.,Female,hair: orange full hair; eyes: none; teeth: none; clothing: ankara; expression: cool; accessories: eye glasses; strength: loving; weakness: sheepish,4f9d99a4-78a2-4fdd-bc30-b027600fa88e,98f21a75cfd394475e0303a9033a4241efb6856754f3018f35263dc4958fcb41
,166,jonny-the-bravo,jonny the bravo,Jonny is friendly to all and everybody sees him as kind agile Jonny.,Male,hair: orange pink; eyes: closed; teeth: candy in mouth; clothing: igbo attire; expression: relaxed; accessories: candy in mouth; strength: helping people; weakness: hastly rash,2b345988-b4b0-453b-ad39-efe1321bc8f1,d51b78e6d32ccf9c820c2cf8c5094e6b6af317b1fc1bce70016af6c3293c0e3b
,167,tunde-the-bigman,tunde the bigman,Tunde is the big man on the street and flamboyant life style is his identity.,Male,hair: none; eyes: closed; teeth: white with one tooth missing; clothing: agbada; expression: resting; accessories: head wear; strength: money; weakness: monkey,56db423e-8b09-453e-b5fc-61f4da9d7a6f,0730aea97691a9a52a11ab8db76df1f113680cd5eb10578808d1934e8ea2abde
,168,joe-the-plain,joe the plain,Plain and simple and no one in town is more gentle that broda Joe.,Male,hair: none; eyes: watery blue eye; teeth: tongue out; clothing: agbada; expression: happy; accessories: face cap; strength: handling situation; weakness: overthinking,7a3083bd-5aa2-48b5-a30b-4445cc060f57,2c7d569ceaa3fadc0e7fb84a347c8e44c198901e4b18631efffd0fea9bca91ea
,169,wale-sharp-guy,wale sharp guy,Wale no de carry last because he thinks and act fast.,Male,hair: none; eyes: closed; teeth: white with a tooth missing; clothing: agbada; expression: fearful; accessories: blue head scaf; strength: smart; weakness: too forward,44906ea0-901b-4b3d-802f-f73acc8758f6,3525cbbd6192e64bd36ae31cef71c4a5fbb362109097d7d8acd0d6f592d16cd1
,170,dele-the-snoozer,dele the snoozer,If sleeping were to be a job then Dele will be the world busiest man.,Male,hair: low cut; eyes: closed; teeth: gapped teeth; clothing: agbada; expression: snoozing; accessories: none; strength: loving; weakness: sleep,4f9d99a4-78a2-4fdd-bc30-b027600fa88e,09b6d2c6bbf214ec9d9c53d2f42363f52a3f4e6a8265dfed0efb0472800807f0
,171,father -of -tolu,father of tolu,Baba Tolu is a proud father. He will sell his soul just to see Tolu excel in life.,Male,hair: none; eyes: black iris; teeth: long front tooth; clothing: ankara; expression: fearfully; accessories: head cap; strength: fatherly; weakness: women,a2651258-ca3f-4940-b095-3a61ff630263,5a071c969530311875e421eb45d98b74c31d0cde7797d521f2fbfe4faee53785
,172,emeka-the-chief,emeka the chief,Chief Emeka is the pillar of the community. Just and fair to all. The real mazi.,Male,hair: none; eyes: black iris; teeth: full white teeth; clothing: wrapper wrapped around body; expression: smiling; accessories: head cap; strength: leadership; weakness: anger,de25fd63-dafd-4f77-8072-7ac0ae3a3ab2,e5dfb71d9ba2a2156c3d20b4feebac9756c9ed449cedbd886e57f0104452c069
,173,lawal-the-drooler,lawal the drooler,Lawal has only one business which is just to sleep and sleep. it's only normal for him to drool anytime.,Male,hair: none; eyes: teary grey iris; teeth: gapped teeth; clothing: agbada; expression: sleepy; accessories: head wear; strength: rich; weakness: alcoholism,806b640f-1c8b-4cc0-aa10-45f3ddc00140,b55e45ce81e64da472e875f3567351a897b43d3ea9dedf1a22f5548a85599507
,174,solo-the-messenger,solo the messenger,"Solo is a multitasker if you need anything done in your home, Solo is your guy.",Male,hair: none; eyes: black eye; teeth: stained tooth; clothing: simple top; expression: relax; accessories: cap; strength: multitasking; weakness: women,44906ea0-901b-4b3d-802f-f73acc8758f6,b581130945e2ff7d447e2e89e155e020efefbce29bddbdf7a08119f57b07a8c2
,175,femi-the-honorable,femi the honorable,Honorable Femi is the modern day politician but everything he does is only to further his political career.,Male,hair: none; eyes: blue iris; skin color: brown; teeth: one missing tooth; clothing: aso oke; expression: happy; accessories: abetiaja cap; strength: public speaking; weakness: money,af53bf52-b517-4347-adc6-07cf30c19025,1b14344ed3e791862a02034124b4430ee07ebc8dbc9f947342f52d735e142da8
,176,friday-the-bigsboy,friday the bigsboy,Friday always live up to his name. Every Friday is for the party.,Male,hair: orange afro; eyes: black iris; skin color: brown; teeth: none; clothing: aso oke; expression: unconcerned; accessories: cigrette in mouth; strength: money in pocket; weakness: sense of responsibility,05ec3aae-7da8-4125-93fb-6fc544e5bc61,74a8f729d2799eba64e99681163459df329b391a285bb3c63f2d7da95303d395
,177,kweku-the-planter,kweku the planter,Kweku says he did it but he dey plant until he was bursted.,Male,hair: none; eyes: closed; teeth: none; clothing: aso oke; expression: smiling; accessories: head wear; strength: industrious; weakness: criminally minded,af53bf52-b517-4347-adc6-07cf30c19025,cfe5a10d021ffbe7bc3b5295178e34a2fdfd71421e24d34033de8c6c71d11683
,178,2pac-the-remix,2pac the remix,2pac is alive in him because his style is exactly the same.,Male,hair: none; eyes: blue iris; teeth: gapped teeth; clothing: Igbo clothing; expression: surprised; accessories: face cap; strength: hardworking; weakness:fear,9993e5ec-2f31-485c-9c6d-f780c078ae56,5b08524129a031fa97c53d8529c69c3ca1b3e455360b03509e253eef429d8ca2
,179,tope-the-influencer,tope the influencer,Tope is a famous influencer and she is loved by his followers which keep growing everyday.,Female,hair: none; eyes: black iris; teeth: none; clothing: agbada; expression: tired; accessories: tied head scaf; strength: Influencing people; weakness: talk too much,3b3e1f66-922b-4f87-8cdb-0d09fc143182,1ceaeb303b9280b4f5116b244859a72199f1558b9bcbcd0f7aae89dcab553d1d
,180,gabby-the-evangelist,gabby the evangelist,Evangelist Gabby is blending gospel with comedy.,Male,hair: pink hair; eyes: black iris; teeth: none; clothing: agbada; expression: happily surprised; accessories: none; strength: make people happy; weakness:misleading,ac721b71-cbc5-425c-851f-ee826973f0b9,3f8082fc9d1507bd5c073a797fc2ffd00e5cac33e87496b9aab4db0f1607203a
TEAM CRANKSHAFT,181,beauty-of-town,beauty of town,She is the most beautiful in the neighbourhood,Female,hair:pitch; eyes: blue  teeth: none  clothing: top accessories: bow-tie  expression: strengths: powerful; weakness: sentimental,7241a1be-59da-11ed-9b6a-0242ac120002,6e25358f9cf8db45086b5e12249ffc709c419bacb68dfce7d16da4cc65d1d39e
,182,lola-babe,lola babe,Looking hot as always,Female,hair:brown; eyes: blue  teeth: none  clothing: aso-oke  accessories: none  expression: happy;strengths: calculative; weakness: misleading,7241a664-59da-11ed-9b6a-0242ac120002,259346b747ee708f65542ca8cfdba6e28613effa89e914bca598b8be181b12c9
,183,cardy_h-sharp-babe,cardy h sharp babe,Cardy is the sharpest amongst her friends,Female,hair: two brown bun; eyes: blue  teeth: none  clothing: yoruba-clothing(aso-oke)  accessories: none  expression: strengths: free spirit;lack of fear;confidence: weakness;:misleading;influencing people ,7241a7c2-59da-11ed-9b6a-0242ac120002,3316a34b1905a69d58b10e24c21a7bb8f940322ac28fa95e52257883054b60dd
,184,bella-the-baller,bella the baller,Baller for Life,Female,hair: brown; eyes: blue  teeth: none  clothing: igbo-clothing accessories: none  expression: determined strengths: adaptation; weakness: fluency,7241ad26-59da-11ed-9b6a-0242ac120002,64184028ff2ac3082f80ca9eda6cc6c4ebd7a50c231329ef41a73a9bc86393dd
,185,milly-of-roses,milly of roses,Her lips so red like a rose,Female,hair: beige; eyes: blue  teeth: none  clothing: black-top  accessories: none  expression:strengths: cool headed; weakness: pressure,7241af92-59da-11ed-9b6a-0242ac120002,75f711e538588cc3ee4c6ec64216d51a5d26c72ad5d12fa0c283f39df6a3b95f
,186,preciousjada-the-viper,preciousjada the viper,Her words stings likes a viper,Female,hair: ginger afro; eyes: blue  teeth: white teeth  clothing: aso-oke   expression: strong-willed  strengths: confidence; weakness: endurance,7241b12c-59da-11ed-9b6a-0242ac120002,41a567d2ed8c41aa30b9212a77be4eb9b2c63954b5a8eae528faf2532cd98dfb
,187,lolly-of-ny,lolly of ny,Most popular in NY,Female,hair: purple braids; eyes: black  teeth: none  clothing: black and blue top  accessories: none expression: calculative strength: strong willed; weakness: relationship,7241b2ee-59da-11ed-9b6a-0242ac120002,5e30d27d508aeca0a754c9f271319f58e051d0116cc28cc051dbde438e75c84c
,188,disy-the-dancer,disy the dancer,Dances her way into any show,Female,hair: black hair tied with scalf; eyes: black  teeth: none  clothing: one-arm top  accessories: none  expression: bad girl vibes  strength: cleaniness; weakness: perfectionist,7241b4c4-59da-11ed-9b6a-0242ac120002,7dc266a1321c7762e6be393ec3ec84a922b51e027e769ad413765852305a795b
,189,jenny-the-great,jenny the great,The greatest of our time,Female,hair: black tied with scalf; eyes: none  teeth: none  clothing: none  accessories: none  expression: none  strength: badass weakness: cancer,7241b852-59da-11ed-9b6a-0242ac120002,5d31b6c0938a085383e82bf4cbb82050bbcd5236fa581c6abbb29ad736f79051
,190,lolly-the-pop,lolly the pop,Seeing lolly makes me pop,Female,hair: bald; eyes: none  teeth: none  clothing: none  accessories: none  expression: none  strength: peaceful weakness: anger,7241ba00-59da-11ed-9b6a-0242ac120002,177a0b991c5b358dbdc708c5b62532bc02e9f6e14f5c040fe5d4991491cbd860
,191,disy-the-queen,disy the queen,The queen in her own space,Female,hair: one bun dark brown; eyes: none  teeth: none  clothing: none  accessories: none  expression: none  strength: beauty; weakness: lover girl,7241bda2-59da-11ed-9b6a-0242ac120002,2f32d04b54821ea38135b586f1d1f9a249634b980915a35c70f7c77f47da5adf
,192,jennyp-of-lagos,jennyp of lagos,A well known celebrity in Lagos,Female,hair: bald; eyes: none  teeth: none  clothing: none  accessories: none  expression: none  strength: super powerful; weakness: sleeping,7241bf1e-59da-11ed-9b6a-0242ac120002,43418ba288cbf3174ad2d00cdf8d16290193af13aacd6edeaecd3d6d4f71fa62
,193,jada-of-life,jada of life,Her business signature,Female,hair: male; eyes: none  teeth: none  clothing: none  accessories: none  expression: none  strength: calm weakness: sun,7241c202-59da-11ed-9b6a-0242ac120002,4183e06347ab3dc72ef9b547250197e2d11a86bdf459bbbf454667d782dabc5d
,194,sandy-the-rapper,sandy the rapper,She just loves to rap,Female,hair: bald; eyes: none  teeth: none  clothing: none  accessories: none  expression: none  strength: clean weakness: foodie,7241c342-59da-11ed-9b6a-0242ac120002,7cb530e792a374126d8c7aaed9e021538289865b6c23eab26b0212629959b898
,195,dahila-the-genius,dahila the genius,The genius in the family,Female,hair: bald; eyes: none  teeth: none  clothing: none  accessories: none  expression: none  strength: activist; weakness: irrational,7241c4fa-59da-11ed-9b6a-0242ac120002,855b6f2303df01d5d5443275187584aae4019b8173ffa6d8a1df24ef7dc7587d
,196,rosemary-of-yaba,rosemary of yaba,She has a cloth store in Yaba,Female,hair: bald; eyes: none  teeth: none  clothing: none  accessories: none  expression: none  strength: mind games; weakness: insomia,7241c61c-59da-11ed-9b6a-0242ac120002,768a8de59c65fd0bd0330269f82d116ecc8365baf0a26ebe9be60efaa4a6d9d9
,197,jennifer-of -island,jennifer of island,She goes on vacation to the island,Female,hair: bald; eyes: none  teeth: none  clothing: none  accessories: none  expression: none  strength: strong ; weakness: lateness,7241ca18-59da-11ed-9b6a-0242ac120002,c60a230ecc66a689276fd120e74b87a62278ec94aaf8e5a4601fa890031edb94
,198,opeyemi-of-lekki,opeyemi of lekki,Opeyemi lives in lekki,Female,hair: bald; eyes: none  teeth: none  clothing: none  accessories: none  expression: none  strength: conversationist; weakness: traditionalist,7241c8e2-59da-11ed-9b6a-0242ac120002,60edcdf5fbff163379fdf7d2d57189450ba1fd194c76cdb09f2828edc9ac5cd2
,199,vicky-the-artist,vicky the artist,Brings life into what she draws,Female,hair: bald; eyes: none  teeth: none  clothing: none  accessories: none  expression: none  strength: strong willed; weakness: crying,7241cb3a-59da-11ed-9b6a-0242ac120002,182653029a90f411a40a9bb4aa7171b5a469bf395049fadcb72366d7a8f92235
,200,afrogirl-sailor,afrogirl sailor,She loves to sail the ocean,Female,hair: bald; eyes: none  teeth: none  clothing: none  accessories: none  expression: none  strength: height;  weakness: pride,7241cc66-59da-11ed-9b6a-0242ac120002,7d871a0a65478f7286c05044d5645b6fac93182e0655876610d4af44d77b1680
TEAM GEAR,201,ahmed-the-merchant,ahmed the merchant,A rich merchant that sells in babylon.,Male,hair: none; eyes: closed; teeth: none; clothing: one-hand; accessories: none; expression: smiling; strength: business; weakness: alcohol,9996ecb6-4d92-4b51-bc50-d962f68f1ecc,db28fff5fe6f700f58b2a6b9627d00450c2a0493387f320d2f15b96bbcae6416
,202,blind-tonia,blind tonia,A girl that lost one of her eyes in a street fight.,Female,hair: brown; eyes: one; teeth: none; clothing: blouse; accessories: none; expression: none; strength: smiling; weakness: none,4a5f4c6d-d0dd-4b71-b095-86ef11910962,c1e592a5e821c382d8b5cb38dc8e5e4a0df3d959fd10940e889aa5e76eb1f97d
,203,buffy-the-vampire,buffy the vampire,A vampire diary protagonist that got bitten by a vampire in real life.,Female,hair: none; eyes: small; teeth: two; clothing: shirt; accessories: none; expression: none; strength: biting; weakness: none,bd329fd7-dd90-4180-a7a7-03e2d41535cb,8d33aa141284deb1c664d331b3349404886c5ab6cf8e770c2c39db92b6e1ac96
,204,caro-lipstick,caro lipstick,"A girl that puts on lipstick always, even to bed.",Female,hair: brown; eyes: glasses; teeth: none; clothing: blouse; accessories: none; expression: sazzy; strength: none; weakness: none,a34d7a7b-d8f6-46fb-9abc-6d6d7293fffb,6c32891acb89d84acbcb7273cc03c8f2cd8328158ae763784e557127147e4154
,205,charity-the-maid,charity the maid,A maid that works for the fun of it.,Female,hair: none; eyes: small; teeth: two; clothing: shirt; accessories: none; expression: none; strength: biting; weakness: none,22286b60-5f7b-4df3-8cb1-187d02fb83d0,0af6abdadd1f8e8b0f6a3412f805c03e71fdd5ec743fec61fbee28b9e57db73d
,206,charity-with-fakehair,charity with fakehair,A girl with a bald hair but always wears wig to cover her head.,Female,hair: orange; eyes: glasses; teeth: none; clothing: blouse; accessories: normal; expression: none; strength: none; weakness: barbing-saloon,efc0f7f5-d90b-46cc-be0b-6fcaa23a5422,401c93fd31160fbdde534e91fbd5f738a5eb7d3e4f62eec909fd7a2ddeca8c32
,207,daniel-the-hustler,daniel the hustler,A boy that lives in the streets of Lagos hustling everyday to make ends meet.,Male,hair: none; eyes: black; teeth: none; clothing: shirt; accessories: gang; expression: smiling; strength: hustling; weakness: alcohol,355be0ea-e500-41e1-add4-ce868759bb72,3454500c7cc54a94d3daa346c0c651b832d42b68586aafdbb7d5ac60895e56db
,208,grandma-nanny,grandma nanny,A grandmother that does nothing but sleeps all day.,Female,hair: white; eyes: blue; teeth: none; clothing: blouse; accessories: fashion; expression: smiling; strength: design; weakness: none,ec8fe198-5c45-42a6-a909-4cfbcbbf6519,471fc67bb92c79d39ecd7aa62c4d0640f78a544a96b4c656fed1927ce16ddc11
,209,granpa-willy,granpa willy,A grandfather that drinks beer and reads newspaper all day.,Male,hair: white; eyes: black; teeth: none; clothing: shirt; accessories: fashion; expression: smiling; strength: reading; weakness: drinking,facf7001-d028-4e00-bffc-ed1f7c005ecc,c36546ce70c8038a29cc8732955e51ac798fb4b9f8600fd8e02883b6dfeb908a
,210,joshua-gang-leader,joshua gang leader,A boy born to ritualist parents and now runs his own gang.,Male,hair: brown; eyes: black; teeth: gold; clothing: shirt; accessories: ponk; expression: suspicion; strength: none; weakness: none,cc3c5c06-df96-4a0d-a09f-3359c21191f6,bcfad27a3f2ad84744063e43b4600f3c96c3c62636a0e0ce7c1a06b4c1064bce
,211,karashika-queen,karashika queen,A woman of the underworld that influences rich men into giving up their money.,Female,hair: white; eyes: glasses; teeth: none; clothing: blouse; accessories: fashion; expression: none; strength: design; weakness: boys,6e697e86-def8-4fb4-96c9-0f43ab9beea6,3984f9e1297689463aaccd91b43f64f62ac7c88937859796215b3515f2c75977
,212,king-of-baldmen,king of baldmek,A man that was born bald and has never seen a hair on his head.,Male,hair: cap; eyes: black; teeth: none; clothing: shirt; accessories: fashion; expression: smirk; strength: deceit; weakness: none,5142f00b-10b5-47a5-ab8a-8ae71b255b04,3596a4cf6a7071391f87eaba2ea9f9b0757b0479670b9711b025a85ac88e368d
,213,musa-masked-mouth,musa masked mouth,Musa uses a tape to cover his mouth to prevent him from talking too much.,Male,hair: cap; eyes: closed; teeth: none; clothing: shirt; accessories: fashion; expression: none; strength: dressing; weakness: none,9a5e7e95-6552-4a92-ab18-2154678943c2,926f8bebbd030440a2cb5e9a11b2abc519a6fbcb49ff58bfe0c4c54a97705bf7
,214,queen-of-smokers,queen of smokers,A chronic smoker looking for a spouse that will join her to die of smoking.,Female,hair: brown; eyes: glasses; teeth: smoke; clothing: blouse; accessories: none; expression: none; strength: none; weakness: smoking,eb32dfc0-29ee-49db-8833-37a41a6d6d65,a6b5d12a4675425deaf204dd06f15b4d61828cc4c653ce1568949c4fe3929acc
,215,redlips-man,redlips man,A man that kissed a woman and got his lips burnt.,Male,hair: brown; eyes: blue; teeth: none; clothing: shirt; accessories: none; expression: frown; strength: chewing; weakness: none,4d649c12-05a5-44a4-b4ef-eb285b291aff,81ab95ee023d345513b7de9129ee7fdd4f3d7f58f5641ef69d298324d389c0a8
,216,sleevless-maid,sleevless maid,A girl that nevers wears long cloths and gets herself thrown out of churches for indecent dressing.,Female,hair: white; eyes: blue; teeth: none; clothing: shirt; accessories: tan; expression: none; strength: seduction; weakness: none,1cec0f65-2ee4-41a9-a30a-1f7aa9ccd112,752dc49e76bbc1286970b75cc6a9350dd9b7da5b95401dc05f5734784c799e70
,217,stephen-bluecap,stephen bluecap,Stephen always wears blue cap even to the church.,Male,hair: cap; eyes: black; teeth: none; clothing: shirt; accessories: fashion; expression: smile; strength: kindness; weakness: none,9b9de982-0f87-47ee-ae95-0b69b48d0cdf,b9eb11a2c771ea14bb63f81a4b42fcf00d999b4a8a71058efb6fb0b03ad0f448
,218,tinubu-gateman,tinubu gateman,Tinubu has been a gateman all his life.,Male,hair: cap; eyes: blue; teeth: tongue; clothing: shirt; accessories: fashion; expression: laugh; strength: laughter; weakness: none,c587932b-0b8c-4f70-8465-425a1f53df64,6c7a3df90974c9fd37dbc951901d798cc6a49381662546c43d80bc1fd06e89df
,219,vampire-girl,vampire girl,She dresses up as a vampire every haloween.,Female,hair: puff-puff; eyes: blue; teeth: two; clothing: blouse; accessories: none; expression: bite; strength: biting; weakness: none,3bba4477-d84a-440f-af66-12690ea8b2e4,62598aadfd40b8ae8c3c1a4c2241e66ab35e18732255b8a004a85354d2770220
,220,yusuf-the-smoker,yusuf the smoker,A chronic smoker with damaged lungs.,Male,hair: cap; eyes: dark-brown; teeth: smoke; clothing: shirt; accessories: fashion; expression: smile; strength: dressing; weakness: smoking,2af7b970-e212-4627-b818-13c00c8d3a72,dd71de535ef158dd664b2b425112686b9e39983bdf36992ef20ae06b7ad4309b
TEAM TAPE,221,lola-hng-newbie,lola hng newbie,A confused hng participant that cannot understand her project.,Female,hair: brown; eyes: white; teeth: white; clothing: ankara; accessories: none; expression: surprised; strength: none; weakness: confused,0ddbd22c-b3bb-4c72-9f51-0361480bbfa7,df2bbef007a77fa6e2b0b1ebb1525f6f7aeb5718e65a8e016900a1c94671c627
,222,nene-caroline,nene caroline,A housewife that loves taking care of her family.,Female,hair: brown; eyes: white; teeth: none; clothing:ankara; accessories: none; expression: calm; strength: loving; weakness: novice,4ce5bcf3-d4ed-4277-8187-cb1797c1ac7e,7553f6af798db5d23c6f114c9841099d6f7d1cbc76a1a1ebfee5535fb84ac442
,223,wazo-partystopper,wazo partystopper,A Nigerian aunty that loves to attend owambe parties.,Female,hair: black; eyes: white; teeth: none; clothing: aso oke;  accessories: none; expression: proud; strength: energetic; weakness: none,77237cce-bae0-4d60-adad-27055f0eed39,6a2af0c7ea03e31a911720917676b5f8bcb7c96af0274698044f4610958596ec
,224,melanin-janet,melanin janet,A young lady with a soft personality.,Female,hair: brownish pink; eyes: white; teeth: none; clothing: english-ankara; accessories: none; expression: none; strength: calm; weakness: none,a5a2854e-a850-4b15-b3c3-176a79b2d34b,cff057c2dfd05109ab4ee7e5d3f1ac5857734499848a6da2871493e68511025f
,225,leo-sugarmummy,leo sugarmummy,A middle age wild yankee returnee.,Female,hair: pumpkin; eyes: blue; teeth: none; clothing: leopard skin; accessories: none; expression: wild; strength: none; weakness: none,7ec03993-f500-4a41-aa3c-a73df7a0fbed,f3850cc5aaf8440bfc4bb651a9d7bed8e03e79ec516d41a211402c67a8535cc9
