TEAM NAMES,Series Number,Filename,Name,Description,Gender,Attributes,UUID,Hash
,77,argus-greek,argus greek,A man who you will always find on the look out.,Male,hair: bald; eyes: opened; teeth: none; clothing: overall; accessories: nose mask; expression: suspicious; strength: strong;  weakness: lateness,e7f26b26-59d2-11ed-9b6a-0242ac120002,613cb69b32c69c19670356dc5562ec62b83703669126fc07550264f0d14f719d
,78,amahle-of-zulu,amahle of zulu,A traditional man; feeling fulfilled.,Male,hair: bald; eyes: closed; teeth: none; clothing: ankara print; accessories: nose mask; expression: excited; strength: conversationist; weakness: traditionalist,169f93a0-59d2-11ed-9b6a-0242ac120002,ea75e70ffa2c620deccfdcc24174514b0ee813fc5fe9e03d3b35cdce6c6b662c
,79,agnar-ole,agnar ole,A man who feels like an outcast and always has a battle with his mind.,Male,hair: bald; eyes: opened; teeth: none; clothing: overall; accessories: nose mask; expression: furious; strength: strong willed; weakness: crying,f3f11fd0-59d2-11ed-9b6a-0242ac120002,3aed69f7099af79ddb49bf2fa4c75ef0e9fd6fc9cfed4c0309fd60c97b4ff705
,80,adom-kulu,adom kulu,A ghanaian model; proud of his culture.,Male,hair: bald; eyes: opened; teeth: none; clothing: kente; accessories: nose mask; expression: irritated;  strength: height;  weakness: pride,00f6589e-59d3-11ed-9b6a-0242ac120002,3742ab9cf30b90bdc3dcb1b7e1c59d9a7ccb96f23f81feff6cb5c98fe495c8b7
TEAM PRYBAR,81,segun-baller,segun baller,A man who loves to have fun.,Male,hair: black; eyes: black; teeth: none; clothing: kente; accessories: glasses; expression: cool; strength: jovial; weakness: nonchalant,58ac5cf6-b644-41c6-af79-ec9aa5f6bdd1,8ec01eee58075230f2a5a1c71df7dd366f6f099f83b019724f611b725bc26583
,82,bolanle-pepper-dem,bolanle pepper dem,A lady that loves to show off.,Male,hair: bald; eyes: back; teeth: none; clothing: kente; accessories: glasses; expression: proud; strength: strong; weakness: big spender,46966104-775b-4443-90bb-b35afd121653,b36429978659e3ac88413e9d2c750617d3439e92d1b8cce469d41f2ce468cb11
,83,tayo-tailor,tayo tailor,A professional fashion designer.,Male,hair: black; eyes: black; teeth: none; clothing: orange shirt; accessories: glasses; expression: inquisitive; strength: creativity; weakness: opinionated,70828783-ac38-48cf-b966-cfebc92ebd86,724f4dcbffdb118d0a5d97300ecb4f68ee2717b4b0b8255a4a9229a75a6d4b7f
,84,ajasco-comedian,ajasco comedian,A newbie comedian.,Male,hair: black; eyes: black; teeth: none; clothing: green shirt; accessories: glasses; expression: bold; strength: optimistic; weakness: unobservant,8bebdb3a-f0a8-47ba-892f-39aa275fbd0d,70a50bdcf4ad31a213efb538c870bf4c34121f42d3e74b551687c28b97e21f6e
,85,tobi-babyboy,tobi babyboy,A guy who does not like stress.,Male,hair: black; eyes: black; teeth: none; clothing: white shirt; accessories: glasses; expression: friendly; strength: outgoing; weakness: lacks boundaries,3da592d4-5dec-4bc5-8412-f1b2a0269f95,1d007a32e148b60f84c7b85f2465b42c81c9800e246c78fbafa984fdab59b798
,86,esther-sassy,esther sassy,A rude lady.,Female,hair: brown; eyes: grey; teeth: none; clothing: animal print; accessories: necklace & earrings; expression: bold; strength: confident; weakness: judgemental,0642a25a-966d-446f-b021-a6d18e7fa0c5,415b2c59b8ca40ff1a8d469d773e3bd1015d7d6e814803f4103fe2249d55c145
,87,ozo-fineboi,ozo fineboi,A charming person.,Female,hair: brown; eyes: blue; teeth: none; clothing: aztec print blouse;  accessories: choker & hookah; expression: blank; strength: charismatic; weakness: proud,f2286b4d-fae6-48cb-a686-badec16da1d8,07f37f01cca122419425d0bdba7e58f707a2e7f46da5dbfbfb1e6ad6854920ea
,88,ade-party-girl,ade party girl,The life of every party.,Female,hair: brown; eyes: blue; teeth: gap-tooth; clothing: one-sleeved blue top; accessories: none; expression: scary; strength: adventurous; weakness: impulsive,7e3db30c-9faf-430d-ab48-b854fe0456b9,501a1f791df088da33b2bbd73a7fb831f98b28ec8e2762631e563a872124a5f0
,89,john-casco,john casco,A very observant person.,Female,hair: black; eyes: blue; teeth: none  clothing: one-sleeved ankara top; accessories: earrings & necklace  expression: shocked; strength: unpredictable; weakness: loner,2eff88ef-5bc2-4779-917a-533e952e2953,9d49ccfbc29864c72605a10c708620f6ea9cc45d26bbb2faa40dc1f0e4616610
,90,agha-uwa,agha uwa,A woman of high social class.,Female,hair: brown; eyes: blue; teeth: none; clothing: ankara top with strap & full sleeve; accessories: earrings; expression: sad; strength: daring; weakness: loner,8478a002-1eba-4a05-8b98-7170c6e39254,af98e75429e54b99e3bd054580193a5fa9df270045fa242bcb253587137ce828
,91,udeme-great,udeme great,A lady given to adventures.,Female,hair: purple; eyes: black; teeth: none  clothing: ankara top with blue sleeves; accessories: green necklace & green earrings  expression: clueless; strength: decisive; weakness: stubborn,d1476409-6f8b-4be9-8c93-24d9123749c5,8663f2f2051dd334289c7439dd48d2e4c5daca29470b425b203153cc5b616fa9
,92,femi-tech-bro,femi tech bro,A rookie in the tech industry.,Female,hair: brown; eyes: black; teeth: none; clothing: ankara top with blue suspenders; accessories: green necklace; expression: mischievous; strength: creativity; weakness: procastination,ba3ec22a-13d5-4e19-9b7f-aac764fda28c,500918855116684f59dcc06fbd3e9e8a550e78e1e4bd2e6783585c17d076641f
,93,sai-baba,sai baba,A leader of a third-world country.,Female,hair: brown; eyes: black; teeth: none; clothing: off-shoulder ankara top; accessories: earrings & necklace; expression: anxious; strength: trend spotter; weakness: distracted easily,fdfff369-5b57-4612-9f89-f5d408f24a35,9636c3b898eb1896416aee9cd97871f0ee3bc1db1c21e6a9a702f8ae871eb3c4
,94,omo-pastor,omo pastor,A devout christian.,Female,hair: brown; eyes: black; teeth: none; clothing: spaghetti strap ankara top; accessories: green earrings & green necklace; expression: happy; strength: happiness; weakness: too emotional,49e09559-61a6-41ff-811a-272721a7475c,4d6ba73e441aaae73b4f00d95b78de82578a6514a2420ce3d2fb863abd51f81a
,95,obi-container,obi container,A rich south-easterner.,Female,hair: brown; eyes: black; teeth: none; clothing: animal print top; accessories: green necklace; expression: surprised; strength: wealthy; weakness: risk taker,4b64cf48-94fa-4aed-8cf2-452974b48ee3,02da3788ef78cd2c82a428f88604871a711b095b5fc735e24e51255a50ba4bce
,96,erigga-international,erigga international,Superstar from South-South.,Female,hair: brown; eyes: black; teeth: none; clothing: half ankara; accessories: green necklace & red scrunchie; expression: curious; strength: talented; weakness: overconfident,3ac39a5e-7b0c-4371-b0c8-7cb4b68aed2c,03814dfedf6f3b66cc8705e831c9cef5a9a41003f1dcda037ecbeb4a6d15a526
,97,ayo-web3-bro,ayo web3 bro,Someone with no actual knowledge of basic computer principles.,Female,hair: brown; eyes: blue; teeth: gap tooth; clothing: sleeveless ankara top; accessories: green necklace; expression: terrified; strength: tolerant; weakness: illiterate,c137ec2b-18cd-4c29-a194-af29ac9e6c1c,0990c9d0ce5a7a1a3847cca3a16c4f9b2071f3006f5df1a7d9359e9f9bd042fb
,98,phoebe-queen-bee,phoebe queen bee,A self-centred woman.,Female,hair: brown flowing hair; eyes: blue; teeth: none; clothing: ankara top; accessories: none; expression: blank; strength: attractive; weakness: gullible,1277e9c0-81dc-4747-89df-a9d2ae4fcf96,5c0b96b01ccecfcf349d0be0a842e2d18b23ddb575a82a0fe3f9274cd01478d6
,99,rachel-warri-babe,rachel warri babe,A highly disciplined woman.,Female,hair: red braids; eyes: white; teeth: none; clothing: yellow danshiki; accessories: none; expression: blank; strength: assertive; weakness: talkative,19e6af3b-ef2d-46ba-ba05-59fb612ebbee,95783ea06db0b8cd88b81d6fa74be97af97e750a5572953f64d0b9c0267fa49d
,100,adun-preacher,adun preacher,A religious woman.,Female,hair: black short hair; eyes: blue; teeth: none; clothing: blue paisley print blouse; accessories: ankara bonnet & hookah;  expression: blank; strength: bold; weakness: fake,cc4dfedf-c343-48db-ad67-e39452ec2380,9535dd799b6e33cf49cc66cff0ea39af133b2b1dd19aff1dcb764b4b68a45a2d
TEAM CHISEL,101,adebola-omo-oba,adebola omo oba,Adebola loves soft life with her fathers wealth.,Female,hair: brown; eyes: opened; teeth: white; clothing: ankara print ; accessories:none ; expression: staring; strength: bold; outspoken; weakness: pride,fbf43611-f267-4cba-bf4b-a3ffdc122589,495d48bd319e3378e5e6dda4ccce0f67941852e89460e92014886df5b013ef8e
,102,chichi-the-dancer,chichi the dancer,Chichi loves dancing and party.,Female,hair: black; eyes: blue-opened; teeth: none; clothing: ankara print; accessories: none; expression: shocked; strength: dancing; weakness: lovergirl,e7c32b06-7022-49b4-bbe5-81e8c1d58583,d599db9d7dddd0c9cea8639db5b4277bfb968fef74c540fe6996b621161b580b
,103,hammed-the-farmer,hammed the farmer,Hammed owns a farm with his family.,Male,hair: none; eyes: opened; teeth: none; clothing: brown and cream buba; accessories: nose mask; expression: innocent; strength: farming; weakness: drinking,e57d8985-599e-49da-8d62-fc16b7ac93f2,d96719217ac14ad841f99c98dd9361485c045cf0e7f960d85fab9795910ebf88
,104,farida-the-tivlady,farida the tivlady,Farida is a beautiful Tiv woman.,Female,hair: brown; eyes: opened; teeth: none; clothing: ankara print; accessories: lipgloss; expression: cool; strength: cooking; weakness: multitasking,31d3e229-003e-43c8-ba82-38f49cf58ccb,a3002d638fbed9cf4bea9d6c44f99484bdbdeb4ba09b4bec71b437298a826c30
,105,hannah-the-singer,hannah the singer,Hannah loves singing and belongs to choir.,Female,hair: blonde; eyes: opened; teeth: none; clothing: flower print dress; accessories: earrings; expression: angry; strength: singing; weakness: reading,281f5bd7-5282-458b-9811-e369980e7dee,b52f3e715c8f6a92aca63c824ac4fd93a882a5ace834961e0f7577b5ce92f880
,106,nonso-the-igbogirl,nonso the igbogirl,Nonso is a hardworking Igbo girl.,Female,hair: black; eyes: opened; teeth: none; clothing: leopard print blouse; accessories: none; expression: happy; strength: business; weakness: spending,5cfa76df-8376-4505-af12-78af24f108d6,fbe3d2946f77496f6cc027f5c9aa97c10e9943cece4bd2e9a53438a798c61f40
,107,shade-olori,shade olori,Shade loves soft life and makeup.,Female,hair: black; eyes: blue-opened; teeth: none; clothing: ankara print; accessories: none; expression: none; strength: makeup; weakness: sleeping,1a07ca73-d39b-43e9-a0f1-ef9f5e57d3a9,44bbc54df448fef9fd2094125bf39fa9ab73d4f66037d8239f987a175513cb2d
,108,quadri-the-teacher,quadri the teacher,Quadri is a devoted teacher that teaches mathematics.,Male,hair: none; eyes: opened; teeth: none; clothing: yellow on blue jean; accessories: nose mask; expression: none; strength: teaching; weakness: talking,d96a93e7-17a4-4efe-b09b-02185cc81ce8,f6123717eb2410762ff727a457b7b2bf7fd700ddf5f8af58172dbeb261aea03c
,109,Ifeanyi-the-dj,Ifeanyi the dj,Ifeanyi is a music dj that performs at events.,Male,hair: none; eyes: opened; teeth: opened; clothing: animal print; accessories: red cap; expression: none; strength: mixing songs; weakness: none,030f665d-2cd7-4376-aef5-4030dad9f2d6,154c15ab8392654c1d1dfc65bbbf06a5efd7c132ce1674f190ec61a8c630658d
,110,fayo-the-yorubademon,fayo the yorubademon,Fayo is a yoruba demon with excellent communication skills.,Male,hair: bald; eyes: opened; teeth: none; clothing: africa print; accessories: mask; expression: none; strength: determined; weakness: steals,e270e278-a9b5-408d-b527-d518239a997b,acf24e8ddc4d73465baa60c763ff1aabbf8828d7f65032347025a4a297bb1567
,111,nkechi-the-actress,nkechi the actress,Nkechi is an international actress that acts in hollywood.,Female,hair: purpule short hair; eyes: opened; teeth: none; clothing: native print; accessories: smoking; expression: rugged; strength: love; weakness: lie,34b1136d-00b1-4f29-8a03-5b02291d47d5,56a2f0d09860afcd11373e3e1accb08b0f4c7dfb06a7e127bae3e15283dc810c
,112,hamzat-the-mallam,hamzat the mallam,Hamsat is a mallam doing burea de change for a living.,Male,hair: bald; eyes: opened; teeth: none; clothing: wrapper; accessories: none; expression: straight; strength: traditional; weakness: diabolic,592eff9f-93b2-4452-a2ed-5d44ebc969db,9e4ed43b2e3adf300a06dbe872e4f918eee14ac5b344bfb14b752af2f3392e31
,113,nnena-pretty-girl,nnena pretty girl,Nnena is beautiful girl that loves to talk about her beauty.,Female,hair: brown bob marley; eyes: open; teeth: covered; clothing: african print; accessories: sucker; expression: none; strength: giver; weakness: possesive,d9477612-ad63-408e-8d12-24679c647b32,aefe0348226372dab0496526fc26060b42cb094c6348c2850b53c78c5a4cf350
,114,tunde-the-boss,tunde the boss,Tunde is a boss that loves to take charge at work.,Male,hair: capped; eyes: opened; teeth: white; clothing: native cloth; accessories: none; expression: none; strength: cooks well; weakness: bossy,7635c4ee-04f6-4872-bfc9-37e5a73c8fc6,2e4cc442690358fd88593a91ce2d3f16508cbc0546fe89c026df50a146313231
,115,nnamdi-the-barber,nnamdi the barber,Nnamdi is a barber that devotes time to perfect his craft.,Male,hair: brown afro; eyes: open; teeth: smokey; clothing: africa print; accessories: none; expression: none; strength: determined; weakness: loves clubbing,152758f3-9414-45a2-a809-95cb05a3de13,95b18eeb989880089c2bcac71ecc6bc98f85a30da81ac3e9f2e3d4a39d14817a
,116,amaka-the-hypepriestess,amaka the hypepriestess,Amaka is can never be intimidated no matter the circumstance. ,Female,hair: black hair; eyes: opened; teeth: open teeth; clothing: africa print; accessories: none; expression: laughing; strength: independent; weakness: insultive,c7726e84-3c5c-4e66-8677-cbfb5c9ee850,f10406386c366cf05c352b247edebc21ec650b14cc107a5edd3e2b01cdce3e26
,117,kemi-foodie,kemi foodie,Kemi loves food and can also prepare good meals. ,Female,hair: black har with scarf; eyes: partly opened; teeth: none; clothing: one hand style; accessories: none; expression: none; strength: can cook very well; weakness: dirtiness,3116cb6f-14c4-4d5a-af57-54253b72a309,576d07a650c4ae2de9b28b536cff58f11de92f717097278c14f4b2dd3c74d3dd
,118,ada-the-fashionister,ada the fashionister,Ada loves fashion that she rarely repeats cloths.,Female,hair: brown afro; eyes: glasses; teeth: white; clothing: africa print; accessories: none; expression: smiling; strength: successful; weakness: too serious,a14df1c1-7a5a-4a33-8780-0fb01c593da6,3aff83d4413b708af11b262b24121f89a46089e62077a0238c4fafb13f6e7866
,119,kayode-the-baller,kayode the baller,Kayode loves life and lives it.,Male,hair: bald; eyes: wide opened; teeth: none; clothing: yellow on jeans; accessories: none; expression: none; strength: swaggy; weakness: loves women,fe17bfdc-c251-4654-8313-1ab793e11748,ce166d21f3085cc698bd59793c68daa5d94419dfef9759772accd8bc8e3df961
,120,kola-of-lagos,kola of lagos,Kola is the life of the party everywhere he is.,Male,hair: bald; eyes: opened; teeth: none; clothing: native; accessories: none; expression: none; strength: intelligent; weakness: shy,df295be1-1509-406e-a263-28a5dee0abca,ec654e1811efb55ecc8d52cf697a96977b9ab2ff5c9251450c0ea973a211722b
TEAM BRAINBOX,121,azikiwe-popular-trader,azikiwe popular trader,Azikiwe is a popular trader.,Male,hair: none; eyes: blue; teeth: none; clothing: purple and yellow; accessories: cap; expression: happy; strength:strong; weakness shy,7ebde325-8efc-4997-811a-b5686269929e,68c412885c74dd677d5dcebd830213eb458df2f4bc709901e845391d1764e73b
,122,obasanjo-funny-guy,obasanjo funny guy,Obasanjo is such a sweet guy loves by all. ,Male,hair:none ;eyes: black; teeth:small open teeth; clothing: sleeveless yellow ankara; accessories:none; expression: serious face; strength:mild; weakness:anger,c136a120-a339-4080-96ca-1c93845c5848,29633694e387581faae24c144c0664a861077dfaae095369bf729a0b8bfa397b
,123,yakubu-village-chief,yakubu village chief,Yakubu is the best village chieftain.,Male,hair:none ;eyes: blue; teeth:open white teeth; clothing: black isiagu; accessories:cap; expression:happy; strength:strong; weakness:impatience,5b0c0d26-d204-4264-b579-081ff9df935b,5c55cfbdc2edc806663affeee53cebba024a249ab507abd61e9c8ade293635c4
,124,abacha-loves-smoking,abacha loves smoking,Abacha loves taking cigarettes.,Male,hair:cute braided hair ;eyes: black ball white eye; teeth:none; clothing: mixed colors ankara wear; accessories:none; expression:happy;  strength:strong;  weakness: anger,8ac6d95f-0cf3-4f54-9cf2-be8834b3004c,c5452466dc48335a5a789b2cbbb9b4f545194e87ea2f39b0b8a96b9b8505d21f
,125,johnathan-good-leader,johnathan the humanitarian ,Johnathan is very progressive young man.,Male,hair:punk bearded man ;eyes: closed; teeth:none; clothing: white shirt and senator; accessories:cap; expression:bone face; strength:strong; weakness:pride,241e3713-4ce3-48d0-827f-b282ae2db6c4,3f70f22cd08dce784f484845af4a3ef63ab7439627e70004bac9f812e0897450
,126,johnathan-genz-kid,johnathan genz kid,Johnathan is zealous young man.,Male,hair:none ;eyes: blue;teeth: white; clothing: yellow ankara wear; accessories: traditional cap; expression:happy; strength:strong; weakness:arrogance,90c0ae09-a35f-42ad-b93c-dcf30169acd9,b4f80c7448e697e9909c9876969154646fcfd8b86978d594df65eed2b126bb70
,127,eddy-the-community,eddy the community leader,Eddy has so much positive energy.,Male,hair:none ;eyes: blue; teeth:none; clothing: black isiagu wear; accessories: cap; expression: happy; strength: strong; weakness:emotional,5cabf9d9-882b-459e-9253-8c07eb045e2d,6cfb581b5c94f245f9e687b8698823cc11a266c7cb320a385f1126027c5b80ca
,128,olu-the-oba,olu the oba,Olu the great ruler in our land.,Male,hair: purple braided hair ;eyes: black; teeth: none; clothing: mixed color traditional wear; accessories: none; expression: serious face; strength:mild; weakness:anger,04c4b28a-aca0-44b1-a064-ed0d9d2a31ca,18560b6d3e1501d7905df5b0b562edf19cce1b55e330096af8d38e5133e07b3b
,129,edu-the-biggest-trader,edu the biggest trader,Edu is the biggest merchant in west coast.,Male,hair:none ;eyes: blue; teeth:closed; clothing: black and yellow collar native wear; accessories:cap; expression:happy; strength:strong; weakness:impatience,48d1de5f-5f3f-46aa-b2fd-68420a8e802b,657328004e69a39a6d6560fbc250fbe6f7f6e972d0b8db41fef9cd1a0dedd3ef
,130,james-importer-and-exporter,james importer and exporter,James is the sole importer and exporter of spare parts.,Male,hair:none ;eyes: blue; teeth:none; clothing: purple and yellow; accessories:cap; expression:happy; strength:strong; weakness:pride,22541251-022f-480c-8c1e-cf754dce16d6,3dcf21873b83a2d99c16bf03bb8e080f2c659dd711237d265f11e506c7f0327a
,131,lanre-the-dreaded-guy,lanre the dreaded guy,Lanre has a great reputation.,Male,hair: none ;eyes: none; teeth:white; clothing: ankara; accessories:cap; expression: happy; strength:strong; weakness:anger,66a054cd-5541-4000-98aa-8f2e9892d880,309f4bf467a3828b751f2c3c33eb6881fb9e749be10e25483c46fa95d008016a
,132,olamide-the-street-boy,olamide the street boy,Olamide has a sweet voice.,Male,hair:none ;eyes: white; teeth: none; clothing: green and blue; accessories: cap; expression: serious face; strength:strong; weakness:stubborn,d50a35b1-b42e-4e0c-8dd8-9b892b56d371,02793a7657fde89b0f8daa3ccd0fb02144d18d4c146b0b99d61844a8a8bb8227
,133,uche-peace-loving-man,uche peace loving man,Uche man of peace and discipline.,Male,hair: yellow ;eyes: blue;teeth:none; clothing: yellow; accessories:none; expression:happy; strength:strong; weakness:emotional,6c9d6eae-2ea2-468c-a2c8-928aaafc084b,e005d711354e120a20e9f49312706b95fc2770e13c296c2fa34752e98c9a6dae
,134,dave-the-tech-bro,dave the tech bro,Dave is a web3 enthusiast.,Male,hair: none ;eyes: none; teeth:white; clothing: none; accessories:cap; expression: serious face; strength:strong; weakness:none,c0857b11-bf0e-46a4-9108-b8eb93d83e74,62a8a897a051a50b1629c011f3147bd8d6174f19a7b10405f04085cf52b9a326
,135,obi-the-biggest-humanitarian,obi the biggest humanitarian,Obi loves service to humanity.,Male,hair:none ;eyes: blue; teeth:white; clothing: brown; accessories:cap; expression:happy; strength: strong; weakness:none,201a408c-7a2e-42d9-a62c-0136c885c211,f82154edccaab25fb336c2c78f371eb5b6abaa215b2bec6dfec2e63b9d9499b7
,136,precious-the-emotional-girl,precious the emotional girl,Precious is soft hearted and sensitive.,Female,hair:none ;eyes: white; teeth: white; clothing: yellow and blue; accessories:cap; expression:angry; strength:strong; weakness:none,b6a41ff1-51ce-42f7-9933-85d0a22ced68,d192a3ea644a3f92ab8b2d02acd6532a7e1da662603a200843b3d27c5f759052
,137,ella-serious-minded,ella serious minded,Ella a dedicated young lady.,Female,hair: none ;eyes: white;teeth: white; clothing: black and yellow; accessories:cap; expression:happy; strength:strong; weakness:none,04036447-f43e-4bfb-9503-f55c9064b14e,66f0091092fa9fe06ae95a626b6839b16a74375f4310fc5eeb71bced8229f05a
,138,cynthia-cute-eyes,cynthia cute eyes,Cynthia with priceless cute eyes.,Female,hair:yellow ;eyes: blue;teeth:none; clothing: blue and yellow; accessories: none; expression: serious face; strength: mild; weakness:pride,5d12847b-6d71-4691-8337-2e6ef3e283b2,c359df4b8f4063b55cfdf244ac7893cc16daa37b0133ad055a15e9612669c7ce
,139,mary-with-hair,mary with hair,Mary with her beautiful Afro.,Female,hair: none;eyes: none;teeth:none; clothing: casual ankara; accessories:cap; expression:scared; strength:sensitive; weakness: fearful,98035e8b-6540-4464-8a3c-fdac9f07b168,90df162469d7db8c975da9f5c3dd7a4dcc90cd87f7deb5d56075d0fe2990d947
,140,ada-chewing-bubble-gum,ada chewing bubble gum,Ada always chewing gum.,Female,hair: none;eyes: none;teeth: white; clothing: traditional wear; accessories:cap; expression:sassy; strength:decisive; weakness: insensitive,15309dc5-e483-4658-b503-db85ba2c1722,3e80b45e1a8e189374fcb5ef4b372ce611a2cf0180503d9cf2a504434b481b5c
TEAM PLUG,141,viganem-the-drummer-girl,viganem the drummer girl,Known for typically playing the drum for 5 hours per day without a break.,Female,hair: none;  eyes: none;  teeth: none;  clothing: ankara with drum patterns;  accessories: none;  expression: sumg;  strength: none;  weakness: none,5a5a6f5c-39f3-4beb-ab74-60d3c7a90fd4,39d9b310814bbf9e41a9f6dc5fe63162f715a6d080f4b96723775e4ff8bb1103
,142,lenusuka-the-big-woman,lenusuka the big woman,The lady that loves spending money and buying everybody asaobi.,Female,hair: purple;  eyes: none;  teeth: none;  clothing: black and blue ankara;  accessories: none;  expression: serious;  strength: none;  weakness: none,e564a43a-ef77-487d-a88e-749d20a09fd8,d16c1fd83902b881fe4202735233adf79f602826103bc1c0557f3dc7cc70c110
,143,enepua-the-clout-queen,enepua the clout queen,The lady that travels all day and enjoys snapping food at restaurants.,Female,hair: purple;  eyes: none;  teeth: none;  clothing: black ankara with yellow and blue gear pattern;  accessories: none;  expression: chill; strength: none;  weakness: none,6dc7e452-0626-4f4c-a28c-f5db3532e305,b2b13faf500f28b9a4045dd8d23664fd1b3425d7bdee745c6f735e815f484ba8
,144,usifong-queen-of-mushin,usifong queen of mushin,Changes her hair every 2 weeks and cannot finish one pure water.,Female,hair: brown afro;  eyes: none;  teeth: none;  clothing: black ankara with yellow; peach; and blue gear pattern;  accessories: none;  expression: unbothered;  strength: none;  weakness: none,221263d0-8775-49f8-bbf8-4b08b49e1482,707bd7a83d240c4cb5c44a2ff6c00555d5368f000253cafb97879c1f3387c1e3
,145,akinyim-the-clown,akinyim the clown,"The most interesting christmas clown, known for dancing in prisons and hospitals on christmas eve.",Female,hair: burgundy dreadlocks;  eyes: none;  teeth: none;  clothing: kente blouse with asymmetric neckline;  accessories: none;  expression: off-standish;  strength: none;  weakness: none,c1070dce-48a1-4ae8-b9a4-d070859a8377,273d50dc62869d5ef7f684c3626693834cee1111b0c5e1f11a89388735bb72af
,146,zawadi-mr-sleep-everywhere,zawadi mr sleep everywhere,Likes sleeping in the weirdest places especially in clubs.,Male,hair: brown; eyes: none; teeth: none; clothing: kente agbada; accessories: none; expression: goofy; strength: none; weakness: none,c22489fe-574b-47f3-9667-c9c798b2d4df,9402101d128800c6cdb9685288753e19dfe58b115dfbdbe71012d5caa6060210
,147,chepkirui-mr-self-love,chepkirui mr self love,Likes taking care of himself and spending on himself.,Male,hair: burgundy fila cap;  eyes: none;  teeth: none;  clothing: black and kente patterned agbada;  accessories: none;  expression: sleepy;  strength: none;  weakness:none,1a91e778-d214-476b-a667-94e9ecb8b5ce,ef59a8189cbbaabb5385c12b1c651a51b2d2d9f12bf8751fdd9bac60c664a39b
,148,naserian-the-fear-fear-dancer,naserian the fear fear dancer,A timid and dancer who is always afraid of a large crowd of audience and yet his dance moves can raise the dead.,Male,hair: face; cap: turned to the side;  eyes: none;  teeth: none;  clothing: yellow and blue ankara;  accessories: none;  expression: warm;  strength: none;  weakness: none,8177cf38-8284-4eb4-b19c-04473bcb3b5e,a7ec2bdda7d192e052f41bc8e7a6106846450fbd7449f17135fe9db04bdcc7a9
,149,wawuda-the-ashawo-of-africa,wawuda the ashawo of africa,Brags about his body count and follows skirt anywhere.,Male,hair: blue cap;  eyes: none;  teeth: none;  clothing: green top with blue overalls;  accessories: none;  expression: fear;  strength: none; weakness: none,0554bf35-f588-4009-aafc-ef875b878c29,95197a460c2aa5946a5116579ed34938beb784b0df3160c329aaf6bfd97ad9cb
,150,kerubo-the-igbo-smoker,kerubo the igbo smoker,Loves only his igbo and is happy when he finds an old blunt.,Male,hair: brown;  eyes: none;  teeth: none;  clothing: brown shirt with dog pattern;  accessories: none;  expression: smirking   strength: none;  weakness: none,33ba8e73-7949-4bc7-ba27-37ee1d573946,a0ff138eccfc56e93bcff9514e6bd78ed71a7fcd8e843a2a655c25383887777f
,151,rehema-the-olodo,rehema the olodo,Failed primary 5 eight times and like playing football after school.,Male,hair: teal cap with black and white stripes;  eyes: none;  teeth: none;  clothing: purple shirt with yellow accent;  accessories: none;  expression: euphoric;  strength: none;  weakness: none,1fb33783-4898-48cf-8a73-f81afc71e1a8,ba1c1ae0f6d349acf6608b334fec44ad9a361ef7fada1974e6388f2ad6877e70
